{
  "categoryList":             [ "DeFi" ],
  "keywords":                 [ "NFT", "Marketplace" ],
  "trigger":                  [ "fluid", "fluidtoken" ],

  "url":                      "https://app.fluidtokens.com",
  "urlBridge":                "https://app.fluidtokens.com",

  "image": {
    "icon":                   "data:image/jpg;base64,/9j/4QAYRXhpZgAASUkqAAgAAAAAAAAAAAAAAP/sABFEdWNreQABAAQAAAAeAAD/4QMxaHR0cDovL25zLmFkb2JlLmNvbS94YXAvMS4wLwA8P3hwYWNrZXQgYmVnaW49Iu+7vyIgaWQ9Ilc1TTBNcENlaGlIenJlU3pOVGN6a2M5ZCI/PiA8eDp4bXBtZXRhIHhtbG5zOng9ImFkb2JlOm5zOm1ldGEvIiB4OnhtcHRrPSJBZG9iZSBYTVAgQ29yZSA5LjEtYzAwMiA3OS5hMWNkMTJmNDEsIDIwMjQvMTEvMDgtMTY6MDk6MjAgICAgICAgICI+IDxyZGY6UkRGIHhtbG5zOnJkZj0iaHR0cDovL3d3dy53My5vcmcvMTk5OS8wMi8yMi1yZGYtc3ludGF4LW5zIyI+IDxyZGY6RGVzY3JpcHRpb24gcmRmOmFib3V0PSIiIHhtbG5zOnhtcD0iaHR0cDovL25zLmFkb2JlLmNvbS94YXAvMS4wLyIgeG1sbnM6eG1wTU09Imh0dHA6Ly9ucy5hZG9iZS5jb20veGFwLzEuMC9tbS8iIHhtbG5zOnN0UmVmPSJodHRwOi8vbnMuYWRvYmUuY29tL3hhcC8xLjAvc1R5cGUvUmVzb3VyY2VSZWYjIiB4bXA6Q3JlYXRvclRvb2w9IkFkb2JlIFBob3Rvc2hvcCAyNi4zIChNYWNpbnRvc2gpIiB4bXBNTTpJbnN0YW5jZUlEPSJ4bXAuaWlkOjNERjU2MkZFRkIzNzExRUY5MzdGOTI5NUQzMUI2MTIzIiB4bXBNTTpEb2N1bWVudElEPSJ4bXAuZGlkOjNERjU2MkZGRkIzNzExRUY5MzdGOTI5NUQzMUI2MTIzIj4gPHhtcE1NOkRlcml2ZWRGcm9tIHN0UmVmOmluc3RhbmNlSUQ9InhtcC5paWQ6M0RGNTYyRkNGQjM3MTFFRjkzN0Y5Mjk1RDMxQjYxMjMiIHN0UmVmOmRvY3VtZW50SUQ9InhtcC5kaWQ6M0RGNTYyRkRGQjM3MTFFRjkzN0Y5Mjk1RDMxQjYxMjMiLz4gPC9yZGY6RGVzY3JpcHRpb24+IDwvcmRmOlJERj4gPC94OnhtcG1ldGE+IDw/eHBhY2tldCBlbmQ9InIiPz7/7gAOQWRvYmUAZMAAAAAB/9sAhAAQCwsLDAsQDAwQFw8NDxcbFBAQFBsfFxcXFxcfHhcaGhoaFx4eIyUnJSMeLy8zMy8vQEBAQEBAQEBAQEBAQEBAAREPDxETERUSEhUUERQRFBoUFhYUGiYaGhwaGiYwIx4eHh4jMCsuJycnLis1NTAwNTVAQD9AQEBAQEBAQEBAQED/wAARCAEAAQADASIAAhEBAxEB/8QAngABAQADAQEBAAAAAAAAAAAAAAEEBQYCAwcBAQADAQEAAAAAAAAAAAAAAAADBAUBAhABAAIBAgEGCgcIAwEAAAAAAAECAxEEBSExQVEyE4GR0RIiQlJykgZhcaGxwSNT4WKCsjM0VBZDcyTCEQEAAgECAgYIBQUAAAAAAAAAAQIDEQQhMUFRcbESUoGRodEiMmIzYcFCcoLh8aITFP/aAAwDAQACEQMRAD8A/QAAAAAAAAAAAAAAAAAAAAAAAAAAAAAAAAAAAAAAAAAABAFEAUQBQAAAAABAFEUAAAAAAAAAAAAAAAR5vetKze9orWvLMzzA9dL4Z93t9vGuW8RPRXnmfA1u74ve8zTa+jXpyTzz9XU1szMzNrTraeeZ5ZdiFPLvK1nSkeKevobTNxuZ1jBj5Oi1/JDEvxLfX58s192IhjD1pCnbcZbc7T2Rwh7tuNxbtZbz/FKd7l/Uv8U+V5BH47eafW9d7l9u/wAU+U73L+pf4p8ryB4rdc+t673L+pf4p8p3uX9S/wAU+V5A8VuufW9d7l/Uv8U+U73NH/Jf4peQPFbrn1sjHv8AeY+bLMx1W9L72ftuMUtMV3NfMmfXr2fDHQ04aJKbjLSeFtY6rcYdXWYtETE6xPLEw9Of4dv7ba8Y8k64Lc/7s9cN/ExPNyvMxo08OauWusc45woDiUAAAAAAAAAAQS0xETM8kRyzIPOXNTDjtkyT5tK88uf3m+ybu/L6OKOzT8Zet/vZ3WTSs/k07Edf70sR6iGZudxN58NZ+CPb/QUHVUAAAAAAAAAAABG94PuJy7ecdp1ti5NZ9meZomw4Nea7u1Y5r0n7J1cnkn2t5rlj6uEt4qK8tYAAAAAAAAABGr4xu5rWNtSeW/LeY9nq8LZZL1x0te3JWsTMz9TmM2W2bLfLbtXnXyQ7EKu8y+CnhjnfueQHpmAAAAAAAAAAAAAADN4PWZ3mvRWkzPh5GE3PBcE1xWz258k6V92v7XJ5J9rWbZq/T8U+hsoVFeWsAAAAAAAAIqagwOM5vM2vdxz5ZiPBHLLRtlxu+ubHj9msz45/Y1r1HJlbu2uafp0qAOq4AAIAomsdZrAKJrBrAKJrBrAKJrBrAKj3THkyTpjpa0zzaRMs/bcHy3mLbie7r7Mctp8hqkpiyXnStZn8ej1sbZbO+7y+bHJjr27fhH0uhpStKxWsaViNIj6ITFix4qRjxxFaV5oh7iHmZ1aWDBGKvXaecqA4nAAAAAAAAEVAaHjH97Pu1YTN4xH/ALNeukfiwnuOTHz/AHb/ALpEV9tttM26tpjj0Y7V57MCOtZtMRWNZl8GTg4fus/LWnm19q3JDb7Xhu32+lpjvMkevb8IZjk2Xcey6ck/xr72rxcExxpObJNp6YryR42VThuypzYon3uX732y5sOGvn5r1x167TENfm+YuHYp0pa2af3I5PHOhWl7fLE27E/h2+LnFK/u5thGDBHNjpH8ML3WL2K+KGjt800jsba0+9aI/CXj/acnRtq/HPkSxts0/p9rk7rbx+r/ABlv+6xexXxQd1i9ivihz/8AtOX/ABq/FPkP9py/41finyH/AC5vL7XP+vb+b/F0HdYvYr4oO6xexXxQ5/8A2nL/AI1finyPWP5l3OW8Y8W08+9uatbTM/cTts0cZr7Ydjd7eeETr/GW+7rF7FfFC91i9ivih89rbc3x+duaVx3n1Kz52n1y+6BYiImNdE0iOSI0SIegdRQAAAAAAAAAAARUBp+OU0y4snXWa+KdWrb3jOLz9r5/TjmJ8E8ktbw/Zzusutv6VO3PXPsvUTwZm4xWnP4axxvpL3sOHW3P5mXWuGObrt9X0N5SlMdIpSIrWOaIWsRWsViNIiNIiOiGDxPiuDYU0n089o9DHH326oIi1p0iNZlcpjx4KazP7rSys+5wbbHOXPeMdI6Z/Bz+9+ZM2SZpsq93Tm7y3Lafqjmhqt1u9xvMve7i/nW9WPVrHVWHyX8W0rXjf4p6uhRzb29uGP4K9fTL1kyZM1vPy3tkt12nWfteQWoiI4QpzMzxniAg4qPrttruN1l7rb0m9+nqiOu09DpOHcA2+20y7nTPmjl09Ss/RHT4UWXPTHz428sJ8O3vlnhGlfNPJp+H8F3W90vb8nBPr2jlt7tXS7PYbbZU83BTSZ7V55bW+uWVpBozsue+TnOkdUNTDtseLjEa280kKiok4AAAAAAAAAAAAAAADxlxxlx2x2jWtomJ8L57XbV22CuKOXTtT7Uzzy+z57nPj2+C+fLOlKRrPk8JGs8IeZiuvjnojn+DE4rxLHsMOselnvyY6f8A1P0Q5HLlyZslsuW03yXnW1pe93usu83F9xl7VuavRWsc1Xyau3wRjr9U85/Jj7ncTltw4Uj5Y/MATK4AA++x2WXfbiMGLk6b36K162O7Hg+wjZbStbR+dk9LLP0+z4EG4zf66cPmtwhY2uD/AG30n5a8be599nssGzxRhw10iO1ae1aeuZZGhCsuZmZmZ4zLZiIiIiI0iAAdAAAAAAAAAAAAAAAAAASXN/Mu987JXZUn0aaXy/TaezHgdFkvXHS2S3ZpE2n6ocLmzWz5sme/ayWm0+Fa2ePxXm08qd8qW+yzWkUjnfn2Q+ag0WUAAAAzOD7eNzxHDS0a0rM3t/By/e7OHM/K9Ind579NccRHhn9jpmbvLTOXTy1j28WvsKxGHxdNrT7OCgKy2AAAAAAAAAAAAAAAAAAAA13HsvdcMzaTpN9KR/FLj3T/ADRaY2eKntZI+yJcw0tnGmLXrtPuZO/trm08tYj81AWVMAAABu/lb+vuPcr98ukc38rf19x7tfvl0kMvd/et2V7mzsvsV7bd6gIFkAAAAAAAAAAAAAAAAAAABo/mn+2wf9k/yy5p0vzT/bYP+yf5Zc009p9mO2e9j7379uyO5QFhVAAAAbv5W/r7j3K/fLpIc38rf3G49yv3y6Rl7v71uyvc2dl9ivbbvUBAsgAAAAAAAAAAAAAAAAAAANP8y4pvw+Lx/wAeSsz9U61/Fy7ud5t67rb5NvbmyVmNeqeifG4e+O+K9seSPNvSZraPphobK8TSadNZ19Esvf0mMlb9Fo09MIAtqIAACA6D5Wxz/wCnL0ejSPtl0DC4RtJ2exx4rRpkt6eT3rdHgZsMjPfx5bWjlrw9Dc29JpipWeems+lQEaYAAAAAAAAAAAAAAAAAAABJho+PcJtm13m2rrliPzaRz3iPWj6Yb1Je8d7UtFq84eMuKuSs1t/aX5+rquI8C2+7tOXFPc5555iPRt70NHn4JxLBM/kzkr0Wx+l9nO0se5x36fDPVLIy7XLSeU3jrrxYI9zt9xE6Thya9XmW8jIw8I4lm083b2rE+tf0Y+1JOSkcZtWPSijHeZ0itp9DDbvgXCbZL13u4rpiry4qT609Fvqhl7D5dw4bRl3dozXjmpHYifxbmI0jRT3G6iYmmPp529y/ttnMTF8scuVfeoKpNAAAAAAAAAAAAAAAAAAAAAAARQE0FAQUBNBQEUAAAAAAAAAAAAAAAAAAAAAAAAAAAAAAAAAAAAAAAAAAAAAAAAAf/9k=",
    "banner":                 "https://media.fluidtokens.com/misc/FluidTokensEternl2.jpg"
  },

  "label":                    "FluidTokens",
  "caption":                  "Permissionless Lending",
  "summary":                  "Revolutionizing Permissionless DeFi With EUTXO Chains",
  "description":              "FluidTokens kicked off its journey on the Cardano blockchain as a DeFi platform, presenting a diverse range of services like lending, borrowing, staking, and an array of other inventive products including rental options, boosted stake features, and more.",

  "link": {
    "x":                      "https://x.com/FluidTokens",
    "discord":                "https://discord.gg/kyyCw4h98B",
    "github":                 "https://github.com/fluidtokens",
    "linkedin":               "https://www.linkedin.com/company/fluidtokens"
  }
}
