{
  "label":                    "Nio Portfolio Tracker",
  "caption":                  "Nio Portfolio Tracker",
  "categoryList":             [ "Tools" ],
  "description":              "",
  "url":                      "https://nioapp.io",
  "urlBridge":                "https://nioapp.io",
  "image":                    "data:image/jpg;base64,/9j/4QAYRXhpZgAASUkqAAgAAAAAAAAAAAAAAP/sABFEdWNreQABAAQAAAAeAAD/4QMxaHR0cDovL25zLmFkb2JlLmNvbS94YXAvMS4wLwA8P3hwYWNrZXQgYmVnaW49Iu+7vyIgaWQ9Ilc1TTBNcENlaGlIenJlU3pOVGN6a2M5ZCI/PiA8eDp4bXBtZXRhIHhtbG5zOng9ImFkb2JlOm5zOm1ldGEvIiB4OnhtcHRrPSJBZG9iZSBYTVAgQ29yZSA5LjEtYzAwMiA3OS5hMWNkMTJmNDEsIDIwMjQvMTEvMDgtMTY6MDk6MjAgICAgICAgICI+IDxyZGY6UkRGIHhtbG5zOnJkZj0iaHR0cDovL3d3dy53My5vcmcvMTk5OS8wMi8yMi1yZGYtc3ludGF4LW5zIyI+IDxyZGY6RGVzY3JpcHRpb24gcmRmOmFib3V0PSIiIHhtbG5zOnhtcD0iaHR0cDovL25zLmFkb2JlLmNvbS94YXAvMS4wLyIgeG1sbnM6eG1wTU09Imh0dHA6Ly9ucy5hZG9iZS5jb20veGFwLzEuMC9tbS8iIHhtbG5zOnN0UmVmPSJodHRwOi8vbnMuYWRvYmUuY29tL3hhcC8xLjAvc1R5cGUvUmVzb3VyY2VSZWYjIiB4bXA6Q3JlYXRvclRvb2w9IkFkb2JlIFBob3Rvc2hvcCAyNi4zIChNYWNpbnRvc2gpIiB4bXBNTTpJbnN0YW5jZUlEPSJ4bXAuaWlkOjg2NTZEMTUwRkIzNzExRUY5MzdGOTI5NUQzMUI2MTIzIiB4bXBNTTpEb2N1bWVudElEPSJ4bXAuZGlkOkE1NENGQUJDRkIzNzExRUY5MzdGOTI5NUQzMUI2MTIzIj4gPHhtcE1NOkRlcml2ZWRGcm9tIHN0UmVmOmluc3RhbmNlSUQ9InhtcC5paWQ6ODY1NkQxNEVGQjM3MTFFRjkzN0Y5Mjk1RDMxQjYxMjMiIHN0UmVmOmRvY3VtZW50SUQ9InhtcC5kaWQ6ODY1NkQxNEZGQjM3MTFFRjkzN0Y5Mjk1RDMxQjYxMjMiLz4gPC9yZGY6RGVzY3JpcHRpb24+IDwvcmRmOlJERj4gPC94OnhtcG1ldGE+IDw/eHBhY2tldCBlbmQ9InIiPz7/7gAOQWRvYmUAZMAAAAAB/9sAhAAQCwsLDAsQDAwQFw8NDxcbFBAQFBsfFxcXFxcfHhcaGhoaFx4eIyUnJSMeLy8zMy8vQEBAQEBAQEBAQEBAQEBAAREPDxETERUSEhUUERQRFBoUFhYUGiYaGhwaGiYwIx4eHh4jMCsuJycnLis1NTAwNTVAQD9AQEBAQEBAQEBAQED/wAARCAEAAQADASIAAhEBAxEB/8QApgABAQEAAwEBAAAAAAAAAAAAAAEGAwQFAgcBAQACAwEAAAAAAAAAAAAAAAABAgMEBQYQAAIBAwICBQgGCAUFAAAAAAABAhEDBDEFIVFBsRJzBmFxgZEiMhM1ocHRUnI0QmKSssIjVBXiM0MkFvCColMUEQACAQIBCQcDAwUBAAAAAAAAAQIRAwQhMXGxwRIiMnJBUYGRUjMFYUITkiM0odFDUxQk/9oADAMBAAIRAxEAPwD5bdXxJV8yvVnyejPPVLV8yVfMAE1FXzFXzABNRV8yVfMAE1FXzFXzBAWqWr5kq+YAJFXzFXzBATUtXzJV8wAWqKvmKvmCAmpavmSr5gAmoq+Yq+YAJqKvmSr5gAsKvmKvmCAmpavmSr5gAmoq+Yq+ZACxavmE3VcSFWqBJ2HqyFerIDlEBSAkAAFgQoBJAACSApAWAABJAUgJAABYgKQEoAAEkBSAkAAFiApASCFAJIVaohVqgWR2HqyH09WQHKIAASCFICQAAWICgEkAAJICkBYAAEkBQCSAAFiApASAACSAFBJAACxAUgJAWqAWqBKOy9WQPVgHMBCgAgABIIUgJAKQFgQoBJAACxAUgJAABJAUgJAABYgKQEgAAkgKAWIAASQq1QC1QJRzvVgPVgHNAAABCgAgABJAUAsQAAkEKQEgA7Fjb87Jj27Fic4PSdKJ+ZuhEpxiqyajpdC8U3kSb0ZTrA5b+NkY0uzkWpWm9O0qV8xxBNNVTTXehRrOqAAEkkBSAkAAFiApASAACSAoBJAtUAtUCyOd6sB6sA5wAAIAAABCkBIAALAhQCSAAEne2XChm50bd1VtW05zXOmi9ZtIxioqKVEuCS0Rj9gy7eLuC+K1GF6Pw3J6J6xqbFM5HyDl+VJ8u6t3adXAqP4m1n3nXYcOXiWcuxKxejWEvWn0NGDu2pWbs7MvetycX506G+vX7di1K9dajCCrJswV+679+5eao7k5Tp53Uy/HOVZr7cnmY8du8D+7L5HGCkOkaQAAJqQFICQAAWqQFICQAASQq1QC1QLI5nqwHqwDngAAgAHtbPsX/wBCWTmJqy+Nu1o5+WXkMV29C1Hek/DtZktWp3ZbsF49iPNxNvzM10x7blFazfCK9J7Fjwrwrk33X7ttcPXI9+EIQioQSjGPBRXBJH0cy5jrsnw8C+mfzOrawFqK4qzf1zeR5C8M7clxdxvn2qfUcdzwthy/yrtyD8tJL6j3AYlib6/yS8zK8LYf+OJkMvw7n46crdMiC+5wl+y/qPLfBtPg1qnwaP0Fnn7ns2Pnwc0vh5CXs3V0+SS6UbNnHtOl1VXqW01r2AVK2m6+l7DGlOTIx72NelZvR7NyGq+teQ4jpppqqypnOdU6PI0Dv4297njQ+HC6pwXBK4u1TzPgz52vbnuN6dpXPh9iParTtdNKdB6f/E5/1S/Y/wARr3r2HT3LtG1lo41zmzZtX2t+3VVyVTpmPIy9xzc38xccorioL2Y+pHVND/xOX9Uv2P8AEeHkWfgZF2xXtfCk4drStOktYu2ZVja+3LRKhF23djxXfu7W6nEAdnA2+/uF/wCFZ4RXG5cekF9pllNRi5SdEu0pFOTUUqtnXhCdyat24uc5aRiqtnr4vhjNu0lkSjjx+778/o4GhwNtxcC32LMfafv3H70n5ztnMvfITbpaW6u95WdC1g4pVuOr7lmPEt+FcFL+Zcuzfkaj1I+peFdta9mV2L59qvWj2ga//Tf/ANk/Mz/gteiJmcnwnNKuLf7T+5cVP/KJ4uXhZWFPsZNt266S1i/NJcDfnxds2r1uVq7FThJUcZKqZmtY+7F8f7i8mY54WD5eF/0PzwHsbzsUsKuRjVni/pR1lb+2J451LV2FyKlB1RpThKEt2WcgKQuQAtUCrVAlHK9WA9WAaIAD4KoIPS2Pblm5LndVcezRzX3pdEftNelwR0dnxVi7fahSk5r4k/xS4neOHirruXX6Y8MfDt8Tu4SyrdpeqXFLx7AyN049C1ZwZ2bZwseV+9ouEYrWUuhIyGbueXnSbuz7Nv8ARtR4RX2ixhp3sq4YrPJkYjFQs5HxSf2raa+WfhRfZlkW1Ll219pywuW7i7VuanHnFpr6DAUXI5LN69jzVyxOVua6Yun0dJtS+OycM8v1WQ1Y/JOvFDJ9HlN8gzydl3lZq+BfpHJiq8OCmua8p6xoXLcrcnGSo0dC3cjcipQdUzy982xZuO7ltf7iym4frLpiZDU/QzF7zirF3G7CCpCdLkF+LX6TfwF15bT7OKO00cfaSpdXa92Wxnc8Lfnb3dfxI1Bl/C35293X8SNQYMd78tEdRnwPsLTLWDCbl8xyu9l1m7MLuXzDK72XWZfjuefTtMfyHJDq2HBatXL92Fm0u1cuNRivKzb7fg2sDGjYt8acZy6ZS6WzwvC+Ip3ruXJcLS7EPxS95+o05XH3nKf41ywyvSTgrSUPyPPLItAPmU4wi5SajFcXJ8EvSLtyFqErk2owim5SeiSMXuu7Xtxuvi44yf8ALt6V/Wl5TBh8PK9Ki4Us8thnvX42llyt5kaC/wCJNstNxjOV5r/1xqvW6HHb8UbdJ0nG5b8rimvoZlAdFfH2aZXKvfU0v+y7X7fI3+Nl42Vb+Jj3I3I9LT4rzrVHKj8/x8i9i3Vex5uFyPSunyNdKNptW5Q3HGV1Ujcj7N2H3ZfYzSxOElZ4k96DyV7VpNuxiFcyNbsteg7soxlFxkk01Rp6NGJ3rbf7flUgv9vdrK0+XOPoNsebv2GsrbblF/Ms/wAyD/DqvSiuEvO3dXpnwy2MtiLanB98cqMWB5Qds5pCrVALVAlHK9WA9WAaQPu1D4l63b+/OMfW6Hwc2J+bsd5DrRWbpGT+jJjlkl9UbpJJUWi4IoB549GZPxHlSvZ3wE/Yx1Sn60uLZ5R291+Z5XeM6h3rEVG1BL0p+Z5+/Jyuzb9TXkAAZTEfdm9Oxdhetuk7bUk/MbuzcV23G5HScVJeZqpgXobfa+O3Y3dx6jnfIxVIS7atHS+Nk6zj2UTO0ZvxVbpcxrvNSg/RRmkM/wCK/cxfPPqRq4N/+iHjqNrGr9ifhrOv4W/O3u6/iRqDL+Fvzt7uv4kagtjvflojqIwPsR0y1gwu5fMMrvZdZujC7j8wye9l1mX47nn07TH8hyQ6thpvDlr4e125dN2Upv0un1HqHn7E09pxqdEWvVJnoGpedbtyvrlrNqyv2oU9ETxfFGS7eFDHj/rypL8MeL+mhlTR+LIumLPorOPpaTM4dTApKwmu1ts5uMbd5p9iVAADbMBD1fDmQ7O5Rt19i+nCS8q9qJ5Z3Nmi5brjJdE+0/Mk2YsQk7NxP0P+hlstq5CnqRtySipJxfFSVGvIylOCdg/PLkPh3Z2/uSlH1Oh8HLlNSy77WjuT/eZxHoousU33I4zzvSAtUAtUSSjlerAerANMHNifm7HeQ/eRwnNifm7HeQ/eRWfLLpZMOaPUjdgA88ejMTuvzPK7xnUO3uvzPK7xnUO/a9uHRHUeeu+7PrlrAAMhjDNvtXy7G7uPUYh6G32r5djd3HqND5Hkh1HQ+N9yfSdoz/iv3MXzz6kaAz/iv3MXzz6kaeE/kQ8dRuYz+PPw1nX8Lfnb3dfxI1Bl/C/5293XD9pGoRbHfyJaFqK4D+PHTLWDC7l8wyu9l1m6MLuPzDJ72XWZfjuefTtMfyPJDq2Gg8L31PCuWa8bU2/+2XE9oxmy5qws6Mpulm7/AC7nkr7r9DNnUw4y24Xm+yfEtplwdxTtJdsOF7Do7xhPOwZ2Yf5q9u3+KPR6TFNNOklRrg09U0foZ4+7bDbzZO/jtWsh+9X3Z+fy+Uvg8SrfBPlk6p9zK4vDu5xw5ksq7zJg7d/a9wx21cx50X6UV2ov0xOKGHmXX2bePck/wNdZ1FdttV3o00nP3Jp03ZV0HCaHwvgSrPPuKiacLNen70vqOPbvDVyclcz/AGLa4/Bi/af4mtDSwhGEVGCUYxVIpaJI0MZi4yj+O296vNLs0I3cLhpKW/NUpmX9z6OHLvrHxrt96W4uXpS4HMzP+KM5RtRwIP2rlJ3adEVon52aVm27lyMF2vLoWc27s1CEpeWkzVW+L1fF+dgA75yCFWqIVaoFkcj1YD1YBqA5sT83Y7yH7yOE5cT83Y7yH7yKz5JdLJhzR6kbwAh549GYndfmeV3jOqdvdfmeV3jOod+17cOiOo89d9yfXLWAAZDGGbfavl2N3ceoxDNvtXy7G7uPUaHyPJDqOh8b7k+k7Rn/ABX7mL559SNAZ/xX7mL559SNPCfyIeOo3MZ/Hn4azzdkyY42425TdIXK22/xafSbJH58aTZ99hchHGzJdi7HhC7Lgp8q8mbWOsSk1diq0VJLaamAxEYp2pulXWL2Husxm+2HY3O9Vezdpcj6dfpRsk6qqdU9GefvO2f3CwnCiyLVXbb0fOL85q4S6rd1OXLJbrNvF2ndtUjzRe8jHGk2HeFcjHCyZfzY8LM3+mvuvyozty3ctTdu7FwuR96MuDR8nVvWYXoUemMkcuzelZnVaHFn6CUzG3eI7llK1mp3YLgrq99L9ZdJoMbMxcqPasXY3PInx9Wpx7ti5afEsnqWY69q/buLheX0vOc9BQCpiMxKFPm5ct249u5JQitZSdF9J4uf4lx7KdvDXx7mnb/00/rL27U7jpCLeopO5CCrJpHf3Pc7O32HOftXZcLVvpk/sMXevXb92d69LtXLjrJ/9ci3797JuyvX5udyWrfUuSOM6+Gwysxy8U3nexHMv4h3XkyRWZf3ICkNkwgLVALVAlHI9WA9WAawLGUoSjOLpKLTi+TRAQDu/wB53T+pl6l9g/vO6f1MvUvsOkCn4bXoh+lF/wA13/ZP9TPq5cnduSu3H2pzdZS5s+QC6SSouwo226vLUAAkgHbt7ruNqEbdu/KMIKkYpLgl6DqArKEZcyUtKqWjOUcsW46HQ7v953T+pl6l9hwZOblZXZWRcdzscY1pwr5jhBVWradVCKfeoos7txqjnJrubYDAMhjOeznZmOuzZvzhH7qfD1M5v7zun9TL1L7DpAxu1bbq4Qb6UZFduJUU5pfSTObIzcrKSWRc+JTRtKq9KVTgKC0YxiqRSS+hDk5Osm2/qyBNxkpRbjJaNOj+gAkJnahum5W1SOTcpybr1llvG6S4PJn6KLqR1CFPw2s+5D9KMiu3M2/LzZ93bt6863rkrj/XbfWfABdJLIlQirecgKQkkEKASQq1QC1QJR9vVgPVgGuAACAAAAAAAAAAAAAAAAAAAAAAAACAoBYgABIIUAkgABJAUgLALVALVAlH29WA9WAYAAAQAAAAAAAAAAAAAAAAAAAAAAAAAACSApASAACSAoBJAACSFWqAWqBZH09WA9WAYQAAQAAAAAAAAAAAAAAAAAAAAAAAAAAAAACSApASAACQQoBJAtUAtUCyPp6sFadXwJR8gYgBR8hR8gABR8hR8gABR8hR8gABR8hR8gABR8hR8gABR8hR8gABR8hR8gABR8hR8gABR8hR8gABR8hR8gABR8hR8gABR8hR8gCAtHyFHyBJCH1R8iUfIEgLVCj5BJ1XAEo//9k="
}
