{
  "categoryList":             [ "DeFi" ],
  "keywords":                 [ "SundaeSwap", "DEX", "Decentralized Exchange", "DeFi", "Yield Farming" ],
  "trigger":                  [ "sundae", "sundaeswap" ],

  "url":                      "https://eternl.sundae.fi",
  "urlBridge":                "https://eternl.sundae.fi",

  "image": {
    "icon":                   "data:image/jpg;base64,/9j/4QAYRXhpZgAASUkqAAgAAAAAAAAAAAAAAP/sABFEdWNreQABAAQAAAAeAAD/4QMxaHR0cDovL25zLmFkb2JlLmNvbS94YXAvMS4wLwA8P3hwYWNrZXQgYmVnaW49Iu+7vyIgaWQ9Ilc1TTBNcENlaGlIenJlU3pOVGN6a2M5ZCI/PiA8eDp4bXBtZXRhIHhtbG5zOng9ImFkb2JlOm5zOm1ldGEvIiB4OnhtcHRrPSJBZG9iZSBYTVAgQ29yZSA5LjEtYzAwMiA3OS5hMWNkMTJmNDEsIDIwMjQvMTEvMDgtMTY6MDk6MjAgICAgICAgICI+IDxyZGY6UkRGIHhtbG5zOnJkZj0iaHR0cDovL3d3dy53My5vcmcvMTk5OS8wMi8yMi1yZGYtc3ludGF4LW5zIyI+IDxyZGY6RGVzY3JpcHRpb24gcmRmOmFib3V0PSIiIHhtbG5zOnhtcD0iaHR0cDovL25zLmFkb2JlLmNvbS94YXAvMS4wLyIgeG1sbnM6eG1wTU09Imh0dHA6Ly9ucy5hZG9iZS5jb20veGFwLzEuMC9tbS8iIHhtbG5zOnN0UmVmPSJodHRwOi8vbnMuYWRvYmUuY29tL3hhcC8xLjAvc1R5cGUvUmVzb3VyY2VSZWYjIiB4bXA6Q3JlYXRvclRvb2w9IkFkb2JlIFBob3Rvc2hvcCAyNi4zIChNYWNpbnRvc2gpIiB4bXBNTTpJbnN0YW5jZUlEPSJ4bXAuaWlkOjg2NTZEMTQ4RkIzNzExRUY5MzdGOTI5NUQzMUI2MTIzIiB4bXBNTTpEb2N1bWVudElEPSJ4bXAuZGlkOjg2NTZEMTQ5RkIzNzExRUY5MzdGOTI5NUQzMUI2MTIzIj4gPHhtcE1NOkRlcml2ZWRGcm9tIHN0UmVmOmluc3RhbmNlSUQ9InhtcC5paWQ6ODY1NkQxNDZGQjM3MTFFRjkzN0Y5Mjk1RDMxQjYxMjMiIHN0UmVmOmRvY3VtZW50SUQ9InhtcC5kaWQ6ODY1NkQxNDdGQjM3MTFFRjkzN0Y5Mjk1RDMxQjYxMjMiLz4gPC9yZGY6RGVzY3JpcHRpb24+IDwvcmRmOlJERj4gPC94OnhtcG1ldGE+IDw/eHBhY2tldCBlbmQ9InIiPz7/7gAOQWRvYmUAZMAAAAAB/9sAhAAQCwsLDAsQDAwQFw8NDxcbFBAQFBsfFxcXFxcfHhcaGhoaFx4eIyUnJSMeLy8zMy8vQEBAQEBAQEBAQEBAQEBAAREPDxETERUSEhUUERQRFBoUFhYUGiYaGhwaGiYwIx4eHh4jMCsuJycnLis1NTAwNTVAQD9AQEBAQEBAQEBAQED/wAARCAEAAQADASIAAhEBAxEB/8QAkAABAQADAQEBAAAAAAAAAAAAAAEEBQYDAgcBAQEBAQEBAAAAAAAAAAAAAAABAgMEBRAAAgIBAQYDBQYGAQUAAAAAAAECAwQRITFBURIFYTITcYEiUgaRobHB0ULhYoIjM1MU8HJDgxURAQEAAgEDAwQCAgMAAAAAAAABEQIDITESQVFhcSIyBIGRscHRQhP/2gAMAwEAAhEDEQA/AOnAB53sAAAAAAAAAAABdAQwgKAom1ub9w2gDIbQ23vYAyICgIgKQGAAFAAAAAAAAAAAAAAAAAAAACkMABQqAoIiFAAAF0IIC6EAEKCiAoAgKQqoCkCYAAUAAAAAAAAAAAAKQACkUAKREKAAAKBAUaERAXQAQFIVQhQBAUgEBSFVAUhQABUAAAAAAApCABSKAFIgAUgDQFCIUwr8y+VksfApd9sP8kv2QfLXmay3uXdabXC5+nNb4OCRPl104N9+11l74t6/06AGswO8RvmqchKFktkZLyt8vA2Yyxvptpt47TAAAyEKAIQ+iFEBSFVAUgEBSFVAUhUoACgAAKAUigBTKABQABSIHjm3OjFttXmjF9PtexH1fkUYtMr8ixVVR3yl+HizmO4/VUcnXHxqunGk0p22edrX9sVuIutnlrntmZdB9O30PDdHUlfGcpTTejl1bpGF9R30WX1V1tSsqT9SS26a7omn2b/sYLeW3Tww9+n6muvPefyznNx9fn2U6nBud+HVbLzSj8XtWw5Y9O3fVSxn/wAbIp6sWLahZX50teMX5jEZ/ex46+/l/p1gPPGyMfLpjfjWK2qW6UefJ8memhXgCFAEBSFAhSFVAUgVAUhRAAaVAAVAqIUhApCkAoBAKCkQPLLyqMPHnk5Eumqtavm3wivFnqcb9VdxeTm/8KuX9nF82m6Vr3v+ncRLWv7n3TJ7nf6tz6a4/wCKlP4YL83zZhgFZZeNnypiq7F1wW5rejL/APoYumvU/Z0s1IJiO+n7fLpr49Ljtll5OfK2LrqThB7297MQAYcuTk25L5bXLM7Z3PJ7ZketQ9YS/wAtLfwzXj48mdtHvGDPEry4Tco3eStLWbkt8dOaPz07P6SooqsnFpeuoJx137fO0Wa+Vk7ZXTX7dt7LdeOZsnq+7e/ZEZ9Kx1Dwnr1afce+J3um6arvj6MnsUtdYa/kZH1GqXgqVmnrKa9J8f5vuOYJya+G2M5ezg4+Ln4vLw/87mzv7ersQYHZsiV+J0zesqX0a846axM8keTfW6bXW99agKQrKEPohVQhQVUIUhRAUhShSFChQCIoBSAUFSbei2siV533Kiiy97qoSm/6VqfmspyslKyb1nNuUn4yerP0Tvlbh2TNm/Mqnol4tI/Oi3W69/Vjyl7egACIAAAAZVNKguqXn/AluFky84Y8ntn8K5cTc1zkumyuTjJaOMk9GjXnrTd0fDLbH8DHlXr/AFeTXTazbtuzbbrrpdV1krJLc5PU+D5VtbWqkj4nkQivh+KX3DL3Xk49de+snx/wzcLvH/zrJVuv1K56Oej0ktOXA6PEzcbNq9XGn1peaO6UX/Mjhm2229re8+8fJvxblfRLosjx4NcmuKJK+Zy7ee+2/vXeEMXtvcau4Y/qR+G2Oy2v5ZeHg+Blm45oQpCqgKQ0qAAohCkKqtaNrkwOIFFAKZQKQpBTJrj0xS4vazGMii1W1qS3rZJcmjrwzra4c16SMTuFtF+PdhvWUbouubWzp15eKOexPpTFqn1ZVryEvLBLoj/VxZ0l+ApNzqfTJ7XF7jw6Zx2TTjLimdOTWXFXgxmy/Vou/dlx3hvJxKo1W0LWUYLRTr47Oa3nKn6Ocz3T6ZtVkr+3JSrltePro4v+TXevA47a+sdd9fWOeB7Tws2uXTZj2xkuHRL8kZ/bfp/MzLFK+EsfGXmnJaSl4Qi/xMYrGL7MDGhq3N7o7F7TJPfNVMcqyvHgoU1P04RXKOzX3ngctu7cmAAEUAAAAAZXbc6WBlwvX+Py2x5we/7N522qaTT1T2p80z8/O07DN5XaaZa/3Ktapa8eh7PuN8ctzJ9WdrJ1rLBZRcXo1oyGsY7kQhSFaQAFECWrS5gcTUU4gN6tvmBRSkBlFKQpBTFbtx7HKt6J7uT8GZQaTWjWq5M1pv4XPf3c99fKLTn1z+G34Jc/2v8AQyZRjOOkkpRe457LvlhZPp2x6qLPirmt6XGL56GVi5rUeqianW98d6/gezE2ks7V5+suPWM6zEkttfxL5XvMdpp6PY+Rl05lVuib6J/K/wAmetlULFpNbefE53T26O2nPZ026/LX9TXFjV66ntZjThtj8UfvPE52WO+u02mZcuJsbdk297lL8T5OkX0rCzIlY8jTHm+pQivj27enV7DMyvp7t9mJKrHqVd0VrXZq3JyXCTe/U8l7sXaOPAalFuMlpKLaknwa2NAjQAOOi2t7kAAeqejWjW9PYz6qqndbCmHnskoR9regHzw14bteH2nT/SeVXDFvqm9F6usZcNsTcVYmPTjQxVXGVMEl0tJp+L14sxciuqqarphGuEV5YpJav2Hb9aZ5J9K48m2dbPltWoyW3Rp7jHtr6Nq8rPHAV6lrtVPHXdrw0Mu7T03r4aHq5dJZfeTLnptZtPljMhSHlelAAVUHEBPRp8maioUhQKACIpSAgpSFMo8MzErzKXVZsa2wmt8ZHPXY2Z2+zWWsOVkdsJf9eJ1AajKLjJKUXscXtTOvFzbadPy19nPfjm3XtWgx+6QlpHIXS/nW73o2+Pm2QS2+pXw26/YzDzOxVz1niP05/wCuXkfsfA1WuZgWdEk638stsZHq1305J9t6+17uG2u2vf8At2FORVd5H8XGL3i3HhYm/LPhJfmjncfuVVjSn/as4bdnuZtqc+cdI2rrj837v4i6EtnWXD2xq8quEoZPTJxl8E4bFKL8HuaPU+67a7Y9VclJff7yuCe7Yzy8vBbbtr6+jevJ7/25/vXYHlTll4eivl/kqexTfzJ8Gc3di5VEum6mcJLg4v8AFH6C01vJqzy2WdL0dZt/Lg8Tt2bmWKFFUvGck4wj4ts6/t3acXt9aUIqdz890l8TfhyRm6tgFtrDz+1YfcIr14aWLy2w2TXv4+88cDsOFg3K+LlbavLKemkfFJcTZH2oc/sNaabb37Z/LN2xO75Sb3HxDEh6jts+Obeun7Ue7aitXokt7Zh3Z6Xw0LqfzPd7kezi4vDr3t9XLbbLKssrqj1TfSuH8EYU8l5F0VFaVx1enPxZjKUsi1x6uqa87f7fb+hlV1xrWi2t72a5dprLP+1mGuPS2y+kfRADzPSgAKIQpCqFIUJApCkFBCkFKfJSIpSAiKY+VPHsg6rIK5cnuXvMhb0c5DuU67ZwuXXBTkk1sktp24OObbW9ftc+Tbxn1MjtbWssd9S/1vf7meFOXkYsuh6tLfXPh7ORtqrqro9VUlJcea9qJdj03x0tjrylua9jPbn0rhj2fOLn12tOuTrt+V7H7uZtKe4ftvWn86/NHN5HbbqtZVf3ILbs8y9wx+43VfDZ/cgtm3zL3kusvZM+7sIyjOPVFqUXxW4jhyNLiZsZfHj2aPjB7/fE2NfcYPZbFxfOO1HLfim35TP+WpbOz36JciqD47D5WXjP/wAi+8+J5+PHc3N8kv1OU/W0z61rz2ZCSW4x782qrWMfjnyW5e1mHkZ05xfU1VUt+38WaqzPnZP0cKDsm/3aa/Yv1O80knpJGGfl5uzryJ6R4R/RGFVZl9ws9PGTpoXnu46fqe2N2Vyl62fP1Jvb6aez+p/obWMYwioQSjFbktiRz359demn3X39HTXit/LpPb1fFFFWPUqqlpFfa3xbfM+wQ8uc9a9EACFUIUhQIAUoACigAiqUgIilICClIUiBiZfbMXL1lJenb/shsf8AUuJlgTa63OtwlkvSxzWT2/NwJeotXBbra939XI9cfum6OQv/AGR/NHQGvzOy49+s6f7Nvh5H7Vw9x6tP2ZenJMfMcNuGzrr/AEkJxnFTg1KL3NHjkYVGRtkumfzx3+/ma6yrN7dZ8ScNd0lthIy8fuddmkbl6c/m/a/0O87Z1uZ8OfxZhh34eRjPrW2K3WQ4e3ketPdLorS2KsXPdI2iezVbU+O8xb+3UWvqj/bl/Lu+wuZe6Y9nwu60abYTT5bGfE+7LdVXt4OT/JEXaHrtt2eEdpkV4+LhR9RtJ/PLf7h9p1Y8cXKy2p5UnCHCHH3LgbLDlRjTji1qMXZrs/e9NurZq8nuk5axoXRH535n7OR79owcpZEcu1OEFrp1+aWq03HPlx4Xy6dOk+WuPPlMfy3hADwvWEAKoQAogAKqAAqAAAFICEUpASqpSAiKUgApT5KRFBCkElGM4uE0pRe+LWqNVl9ihLWeI+iX+qXl9z4G2BvTfbS51uGdtJt3jlo25mBZ6c04865+V+z+BnV90x5L41KEuK01RuLqar4endBThyfD2cjVW/T8XLWi7pj8s1rp70erX9jTb8p41x24tp+PV4Xd1glpRFyl80tiXuMenFze4z61rKPG2WyK9n8DaY3Y8euSlfL1mt0dNI/xNkkkkkkktiS2JGd/2JOmkzferrw2/l0+jDw+1Y2LpNr1bfnkti/7Y8DM1BDzbbXa5tzXaaydJMKQANBAABACqEAKlAAUAAAAAApARVKQEFKQERQQoApABQQEFBAEUgAwoAQopAABAC4UIAUAAVAAAAAAAAAAACkBDKlIAqggIighQBdSAgagAAAQooIAAAKoQAJkABQAAAAAAAAAAAAAAAAAAApAQyoIAqgJN7k2BgAA01vTQwAIAKQAJkABQAAAAAAAAAAH/9k=",
    "banner":                 "https://cdn.sundaeswap.finance/EternlBannerV2.jpg"
  },

  "label":                    "SundaeSwap",
  "caption":                  "The sweetest DEX on Cardano.",
  "summary":                  "SundaeSwap is a decentralized exchange on Cardano.",
  "description":              "SundaeSwap is a decentralized exchange on Cardano. It is a community-driven project that aims to provide a safe and secure platform for users to trade their tokens.",

  "link": {
    "x":                      "https://x.com/SundaeSwap",
    "discord":                "https://discord.gg/Sundae",
    "reddit":                 "https://www.reddit.com/r/SundaeSwap/",
    "github":                 "https://github.com/SundaeSwap-finance",
    "medium":                 "https://sundaeswap-finance.medium.com/",
    "forum":                  "https://forum.sundaeswap.finance/"
  }
}
