{
  "categoryList":             [ "Collectibles" ],
  "keywords":                 [ "NFT", "Marketplace" ],
  "trigger":                  [ "jpg", "jpgstore" ],

  "url":                      "https://www.jpg.store",
  "urlBridge":                "https://www.jpg.store",

  "image": {
    "icon":                   "data:image/jpg;base64,/9j/4QAYRXhpZgAASUkqAAgAAAAAAAAAAAAAAP/sABFEdWNreQABAAQAAAAeAAD/4QMxaHR0cDovL25zLmFkb2JlLmNvbS94YXAvMS4wLwA8P3hwYWNrZXQgYmVnaW49Iu+7vyIgaWQ9Ilc1TTBNcENlaGlIenJlU3pOVGN6a2M5ZCI/PiA8eDp4bXBtZXRhIHhtbG5zOng9ImFkb2JlOm5zOm1ldGEvIiB4OnhtcHRrPSJBZG9iZSBYTVAgQ29yZSA5LjEtYzAwMiA3OS5hMWNkMTJmNDEsIDIwMjQvMTEvMDgtMTY6MDk6MjAgICAgICAgICI+IDxyZGY6UkRGIHhtbG5zOnJkZj0iaHR0cDovL3d3dy53My5vcmcvMTk5OS8wMi8yMi1yZGYtc3ludGF4LW5zIyI+IDxyZGY6RGVzY3JpcHRpb24gcmRmOmFib3V0PSIiIHhtbG5zOnhtcD0iaHR0cDovL25zLmFkb2JlLmNvbS94YXAvMS4wLyIgeG1sbnM6eG1wTU09Imh0dHA6Ly9ucy5hZG9iZS5jb20veGFwLzEuMC9tbS8iIHhtbG5zOnN0UmVmPSJodHRwOi8vbnMuYWRvYmUuY29tL3hhcC8xLjAvc1R5cGUvUmVzb3VyY2VSZWYjIiB4bXA6Q3JlYXRvclRvb2w9IkFkb2JlIFBob3Rvc2hvcCAyNi4zIChNYWNpbnRvc2gpIiB4bXBNTTpJbnN0YW5jZUlEPSJ4bXAuaWlkOjg2NTZEMTRDRkIzNzExRUY5MzdGOTI5NUQzMUI2MTIzIiB4bXBNTTpEb2N1bWVudElEPSJ4bXAuZGlkOjg2NTZEMTRERkIzNzExRUY5MzdGOTI5NUQzMUI2MTIzIj4gPHhtcE1NOkRlcml2ZWRGcm9tIHN0UmVmOmluc3RhbmNlSUQ9InhtcC5paWQ6ODY1NkQxNEFGQjM3MTFFRjkzN0Y5Mjk1RDMxQjYxMjMiIHN0UmVmOmRvY3VtZW50SUQ9InhtcC5kaWQ6ODY1NkQxNEJGQjM3MTFFRjkzN0Y5Mjk1RDMxQjYxMjMiLz4gPC9yZGY6RGVzY3JpcHRpb24+IDwvcmRmOlJERj4gPC94OnhtcG1ldGE+IDw/eHBhY2tldCBlbmQ9InIiPz7/7gAOQWRvYmUAZMAAAAAB/9sAhAAQCwsLDAsQDAwQFw8NDxcbFBAQFBsfFxcXFxcfHhcaGhoaFx4eIyUnJSMeLy8zMy8vQEBAQEBAQEBAQEBAQEBAAREPDxETERUSEhUUERQRFBoUFhYUGiYaGhwaGiYwIx4eHh4jMCsuJycnLis1NTAwNTVAQD9AQEBAQEBAQEBAQED/wAARCAEAAQADASIAAhEBAxEB/8QAnAABAQEBAQEBAAAAAAAAAAAAAAEHBQYDBAEBAAMBAQEAAAAAAAAAAAAAAAEDBQQCBhABAAEBBAMMCAcAAwAAAAAAAAECAwQFBhFzNSExQbHRksLSk1QWNlGRElITUxUXYXHBIjJCVYHhBxEBAAECAQcKBgMBAAAAAAAAAAECAwQRMVFxkRMFIUGx0RJScjMUFWGBoeGSU8EiMkL/2gAMAwEAAhEDEQA/APUgj5F3qIAogCiAKIAogCiAKIAogCiAKIAogCiAKIAogCiKAioAAJAAAAAAAAAAAAAAAAAAAAAAAAAAFRRAioAAJAAAAAAAAAAAAAAAAAAAAAAAAAAFRRAioAAJAAAAAczHMdumDXeLS2j4lvaafg2ETomrRwzPBTHperduq5VFFEdqqrNEPMzERll0xnVtnnHa65mzmysqZncops4nRH51aZfPxtmD51HZ08jv9qv6bcfOVe/p+LSRm3jXMHzqOzp5DxrmD51HZ08h7Tf71vbPUb+n4tJGbeNcwfOo7OnkPGuYPnUdnTyHtN/vW9s9Rv6fi0kZvTnfH4nTNrZ1fhNnT+j1OX813fF6ou14pi733+tMT+y19Psad6fwVXuHX7VM1zFNcRn7PLkTTepmcmZ3wHGsABIAAAAAAAAqKIEVAABIAAAAzHNl6tLzj169qf22NUWVEeimiNHHutPZTmPbt/11XG0+ERG9rnnijplRf/zGt63K+RsLv2E2N/xGbS0tLzE1UUUVezTRTEzEb2/M6NLsfbvLXy7XtJfvyh5aw/VdKXZbbmeX+3eWvl2vaSfbvLXy7XtJeoAeX+3eWvl2vaSfbvLXy7XtJeoAYfjtzsLjjN8ud3iYsbC0miiJnTOiPxfhpqqpqiqmZpqpmJpqidExMcMOpmvzHiOvqckGgZYzXF/mi4YhVFN83rK2nci20cFXor4/zeoYzEzE6Y3Jjel7vK+bKb1FGH4lXEXmP22N4q3ItfRTXPvfjw/mx8fw/Jlu2Y5M9VEc3xh0Wrv/ADV8perDd4d8ZK8AEgAAAAACoogRUAAEgAAAKynMe3b/AK6rjasynMe3b/rquNqcI8y54I6VGIzRraplDy1h+q6Uuy42UPLWH6rpS7LacwAAADFc1+Y8R19TkutmvzHiOvqckBYmUAe4ytmz4k2eG4nX+/cpu95qn+XBFFpPp9E+t7D8OFjEPaZXzboijDsUr3NymwvNXB6KLSeKWTjsBly3bMfGqiOmF9q7/wA1fKXswGO6AASAAAAKiiBFQAASAAAArKcx7dv+uq42rMpzHt2/66rjanCPMueCOlRiM0a2qZQ8tYfqulLsuNlDy1h+q6Uuy2nMAAAgMWzX5jxHX1OS1TGsgXDFb/aX6m8V3au2/da0U0xVTNXvRp0aNL8P2tun+hadnT1gZyNG+1t0/wBC07OnrH2tun+hadnT1gZyulov2tun+hadnT1n4cZ/89u2GYXeb/Tfa7Sq70e3FE0RETuxG/pAyXmC1taowi91e3MUzN1tJ39FO7NnM/lvPYMry3VNOPXGaZ0T8amP+J3JaqweKWqaL0TTGTeU5ZiNLqsVTNPLzIAz1wAAAAqKIEVAABIAAACspzHt2/66rjasynMe3b/rquNqcI8y54I6VGIzRraplDy1h+q6Uuy42UPLWH6rpS7LacwAAACKAAADjZv8tYhqulDsuNm/y1iGq6UAyvLu3bhrqeNqzKcu7duGup42rMXi/mW/BPS6bGadaAMteAAAAKiiBFQAASAAAArKcx7dv+uq42rMpzHt2/66rjanCPMueCOlRiM0a2qZQ8tYfqulLsuNlDy1h+q6Uuy2nMAAAAAAAAONm/y1iGq6UOy42b/LWIarpQDK8u7duGup42rMpy7t24a6njasxeL+Zb8E9LpsZp1oAy14AAAAqKIEVAABIAAACspzHt2/66rjasynMe3b/rquNqcI8y54I6VGIzRraplDy1h+q6Uuy42UPLWH6rpS7LacwAAAAAAAA42b/LWIarpQ7LjZv8tYhqulAMry7t24a6njasynLu3bhrqeNqzF4v5lvwT0umxmnWgDLXgAAACoogRUAAEgAAAKynMe3b/rquNq0MpzHt2/66rjanCPMueCOlRiM0a2nZUvdhZZbw+murd+FvRu/wBpdX6hdvTPqeYy5sK5av8AWXSeL3Fb9N2uimmjJRVNObRL1Th6JpiZmeWMrq/ULt6Z9R9Qu3vT6nKFfu+I0W9n3evTUaanV+oXb3p9R9Qu3vT6nKD3fEaLez7npqNNTq/ULt70+o+oXb3p9TlB7viNFvZ9z01Gmp1fqF296fUfULt70+pyg93xGi3s+56ajTU6v1C7emfU5Wa71YWuW8Qpoq3fhb07n9oHNzHsK+6v9YWWeK36rtFFVNGSuqKc2l5rw9MUzMTPJDweXNu3DXU8bVmU5c27cNdTxtWl74v5lvwT0vOHzTrQBlrwAAABUUQIqAACQAAAFhlOY9u3/XVcbVWYZru1pd8evcV71rV8WifTTXGn/pp8ImN7XHPNH8qMR/mNb22XNhXLV/rLpPJ5ezTht3w2yul9qqsbWwiaYq9maqaqdOmP48O66fi3AO8zzK+RyYjB4ib1yYtVzE11TExGWMkyuou0dmn+0ZnZHG8XYB3ieZXyHi7AO8TzK+RV6PE/pufjL1vaO9G12RxvF2Ad4nmV8h4uwDvE8yvkPR4n9Nz8ZN7R3o2uyON4uwDvE8yvkPF2Ad4nmV8h6PE/pufjJvaO9G12RxvF2Ad4nmV8h4uwDvE8yvkPR4n9Nz8ZN7R3o2uy5uY9hX3V/rD4eLcA7zPMr5HMzDmnDbxhtrc7lVVbWtvEUzV7M00006dM/wAuFbh8JiIvW5m1XERXTMzMZIyRLzXdo7NX9ozPO5c27cNdTxtWll+VLtXeMeukUb1lV8WufRTRGlp7r4vMb2iOeKP5U2P8zrAGYvAAAAFRRAioAAJAAAAHKx7ALtjVhTTXV8K82Wn4NtEadGn+tUcNLqj3buV26orons1RzvMxExklmt4yZmCxtPZosIt6eCuzrpmJ50xL5eEsx9yq51HWaeO+OLX8nLRbnb1qtxTplmHhLMfcqudR1jwlmPuVXOo6zTw92vdy39es3EaZZh4SzH3KrnUdY8JZj7lVzqOs08Pdr3ct/XrNxGmWYeEsx9yq51HWPCWY+5Vc6jrNPD3a93Lf16zcRplmHhLMfcqudR1jwlmPuVXOo6zTw92vdy39es3EaZZh4SzH3KrnUdZ9bvkzMFtaezXd4sKeGu0rpiI5szLSgni1/JyUW429ZuKdMuVgOAXbBbCqmir4t5tdHxraY0adH9aY4KXVBwXLlVyqa657VU862IiIyQAPD0AAAAKiiBFQAASAAAAAAAAAAAAAAAAAAAAAAAAAAKiiBFQAASAAAAAAAAAAAAAAAAAAAAAAAAAAKiiBFAQUBBQEFAQUBBQEFAQUBBQEFAQUBBQEFAQUBBQEUAf/2Q==",
    "banner":                 "https://static.jpgstoreapis.com/photos/jpg_banner.png"
  },

  "label":                    "jpg.store",
  "caption":                  "The first NFT marketplace on Cardano.",
  "summary":                  "jpg.store is a decentralized NFT marketplace on Cardano.",
  "description":              "jpg.store is a decentralized NFT marketplace on Cardano. It is a community-driven project that aims to provide a safe and secure platform for users to trade their tokens.",

  "link": {
    "x":                      "https://x.com/jpgstorenft",
    "discord":                "https://discord.com/invite/jpgstorenft",
    "forum":                  "https://help.jpg.store/en/"
  }
}
