{
  "categoryList":             [ "Collectibles" ],
  "keywords":                 [ "Marketplace" ],

  "url":                      "https://adapunks.io",
  "urlBridge":                "https://adapunks.io",

  "image": {
    "icon":                   "data:image/jpg;base64,/9j/4QAYRXhpZgAASUkqAAgAAAAAAAAAAAAAAP/sABFEdWNreQABAAQAAAAeAAD/4QMxaHR0cDovL25zLmFkb2JlLmNvbS94YXAvMS4wLwA8P3hwYWNrZXQgYmVnaW49Iu+7vyIgaWQ9Ilc1TTBNcENlaGlIenJlU3pOVGN6a2M5ZCI/PiA8eDp4bXBtZXRhIHhtbG5zOng9ImFkb2JlOm5zOm1ldGEvIiB4OnhtcHRrPSJBZG9iZSBYTVAgQ29yZSA5LjEtYzAwMiA3OS5hMWNkMTJmNDEsIDIwMjQvMTEvMDgtMTY6MDk6MjAgICAgICAgICI+IDxyZGY6UkRGIHhtbG5zOnJkZj0iaHR0cDovL3d3dy53My5vcmcvMTk5OS8wMi8yMi1yZGYtc3ludGF4LW5zIyI+IDxyZGY6RGVzY3JpcHRpb24gcmRmOmFib3V0PSIiIHhtbG5zOnhtcD0iaHR0cDovL25zLmFkb2JlLmNvbS94YXAvMS4wLyIgeG1sbnM6eG1wTU09Imh0dHA6Ly9ucy5hZG9iZS5jb20veGFwLzEuMC9tbS8iIHhtbG5zOnN0UmVmPSJodHRwOi8vbnMuYWRvYmUuY29tL3hhcC8xLjAvc1R5cGUvUmVzb3VyY2VSZWYjIiB4bXA6Q3JlYXRvclRvb2w9IkFkb2JlIFBob3Rvc2hvcCAyNi4zIChNYWNpbnRvc2gpIiB4bXBNTTpJbnN0YW5jZUlEPSJ4bXAuaWlkOkE1NENGQUMzRkIzNzExRUY5MzdGOTI5NUQzMUI2MTIzIiB4bXBNTTpEb2N1bWVudElEPSJ4bXAuZGlkOkE1NENGQUM0RkIzNzExRUY5MzdGOTI5NUQzMUI2MTIzIj4gPHhtcE1NOkRlcml2ZWRGcm9tIHN0UmVmOmluc3RhbmNlSUQ9InhtcC5paWQ6QTU0Q0ZBQzFGQjM3MTFFRjkzN0Y5Mjk1RDMxQjYxMjMiIHN0UmVmOmRvY3VtZW50SUQ9InhtcC5kaWQ6QTU0Q0ZBQzJGQjM3MTFFRjkzN0Y5Mjk1RDMxQjYxMjMiLz4gPC9yZGY6RGVzY3JpcHRpb24+IDwvcmRmOlJERj4gPC94OnhtcG1ldGE+IDw/eHBhY2tldCBlbmQ9InIiPz7/7gAOQWRvYmUAZMAAAAAB/9sAhAAQCwsLDAsQDAwQFw8NDxcbFBAQFBsfFxcXFxcfHhcaGhoaFx4eIyUnJSMeLy8zMy8vQEBAQEBAQEBAQEBAQEBAAREPDxETERUSEhUUERQRFBoUFhYUGiYaGhwaGiYwIx4eHh4jMCsuJycnLis1NTAwNTVAQD9AQEBAQEBAQEBAQED/wAARCAEAAQADASIAAhEBAxEB/8QAmwABAQADAQEBAAAAAAAAAAAAAAEEBQYDAgcBAQADAQEBAAAAAAAAAAAAAAABAgMEBQYQAAECAgYHBAgEBQUBAAAAAAABAhEDMVFxEjIEIWGBkRQFBhMzgzVBscHhIpJzFmIjYxVSgtJDU6HRcsLiNBEBAAEDBAADCAIDAAAAAAAAAAERAgMhMRIEUYEycZFighMzFAVBQmEiI//aAAwDAQACEQMRAD8A5RznRXStIvOrUOxLaQ+hUW86tRedWpABbzq1F51akAFvOrUXnVqQAW86tRedWpABbzq1F51akAFvOrUXnVqQAW86tRedWpABbzq1F51akAFvOrUXnVqQAW86tRedWpABbzq1F51akAFvOrUXnVqQAW86tRedWpABbzq1F51akAFvOrUNc6KaVpIVuJLQDsS2kK7EtpAAAAAAAAAAAFY8UgAAAAIAAAA0AVjxSAAVjxAACseIAAAAAgAAAAACtxJaQrcSWgHYltIV2JbSAAAEgMPi5sfRuMiQ90yXedTEwx9nHku421rvrBR6AA3naUNYqqIqFpIfPzM1nVd75Rfzdimaprpcx0t15tNGk9OLnatx3dbtY8ePjdWtZlEwzQYXFzdW4cXN1bjf87D8XuRSWaDC4ubq3Di5urcJ72Gn9vcUl4qqiKgh5VZ8VlioipAKz4ixURUhkyJEuZLvOjGMNBfFjvyXcbZ1pXWRMov5uxTMPOXIly1vNjGg9D1utjux4+N+9ZnRWQGGubm6txOLm6txn+dh+L3FJZoMaRmJkx910IQMk6MWW3JbytrTbUAAXQFbiS0hW4ktAOxLaQrsS2kAAATtI1i0qZOXzEuXLuujGPoMZaVIeFjy3Y75utpXbVdncXJ17hxcnXuMEG/52b4fciiqQA5EgAAAAAAAAAAAAAZMifLly7roxiYwNMWW7HdytpXbUZvFyte4cXK17jCBv+dm+H3IpCnpLkPmNvNhCjSeZmZXutqmfWx25MvG/akyTokiQ+W+86EIQ0GQAetixW47eNm1aqgANAK3ElpCtxJaAdiW0hXYltIAAAnZLWLSpDO4STr3mNmJbZcy62iCUni5etkx28rqUr/Epq8gAYJAAAAAAAAAAAAAAAAAAAAAAsSGTIkS5ku86MYw0GmLFdku42b0rqJlO92KZh5y5MuW682MaNKnoet1sV2PHxvpWszorIADdAVuJLSFbiS0A7EtpCuxLaQAABMpePFyde4xsxMbMmXm0QRNJ5rSoPGy9rJkt43caVrpCaIoAOdIAAAAAAtx1S7hddUu4CBNKwKrXJpVFRA3EloG4+1eafpfP7h9q80/S+f3HXxSCaUoT0oDD6l3+GfOXEZ7kWeyMjiJ9y5FG/C6KxU1x2XU+nlSw/yM9px9x1S7jWy6sVle2aw+QAWSAAAZuU7naphwM3KdztU6+j975ZROz2AB6yoAABW4ktIVuJLQDsS2kK7EtpAPHNdztQworWbF8tsxt11Go8+ElVqcPZ62XJk5W0pxiN0xLCBmcJK1mPPltlzLraIR0nHl6uTHbyu40rTSU1eQAMEgAAFbiS1DYciyMjP57sMxG5cc74VgsUOh+2OVIsUSZo/H7it18RpKJmIbbRBNCUJ6EqGipNyAHPVk1HVEP2pdCd4z0f8AI44/Qc5kpGekdhmI9neR3wrBYoYH2xyqqZ8/uNLL4iKSvbdEQ4+86td52HS6qvKtP+R//UfbHKqpnz+4z8lkpGRk9hl49nFXfEsViovviYpCLromHvoEEguhKF9CVFBnVV+bvxLapDsvtjlSrFUmfP7jn+e5GRkM92GXjcuNd8SxWKnRbfE6Q1i6Ja0JSAWS2kEqBhcXN1bjJkTHTJd51MYaD2cPZx5JiyytaeHgrR6AA6EAAAFbiS0hW4ktAOxLaQrsS2kAAATsPDi5WvcY8+Y2Y+82iHpPNaVB42Xs5MlvC6lK/wAQtRAUhzpAABuelfNF+k/2HXnIdK+aeE/2HXmGX1eTO/d48ZJ/FuHGSde4wQRxg4thLzEuY662MadKHoYWU77YpmlZikqyAAgfMyY2W286ijQefGSde4ZvudqGEWiIlMW1ZvGSde45TqaY2ZzO82js2Um9ilabznefQ4/Rp/LaaWWxErWxq1oANVwzcp3O1TCgpm5TutqnX0fvfLKJ2e4APWVAAAK3ElpCtxJaAdiW0hXYltIAAAnZLWLSZmV7napeEk6955zJjsu7s5cLtOnWeZjxXde76mSnHb/XWdU1ema7nahgnrMzD5jbroQjHQeRh2cluTJyt2pEakAAMEtz0r5p4T/Ydgcf0r5p4T/YdgYZfV5M7ppdDnVXStppubKvFfyodFw8vTTvKnIshnE7adfv4fhdBIJsM8Vs2XVu2o9v9j+y62frxjx8uUXWzrbTZp+llX908J/sOvMDI8lyOQn9vIv34K34nRSC7EM8vfdEzo8O6ayAAohicz/+X+ZpqfQpuc81HyLrqLyUGv4eXr3lLsd101h7n639j1+v1px5Iu5TfdOltd3IuVby2qRTsftjlS6YTdP4/wDyc9z3IyMhnuwy97s7jXfEsVi47Lb4nSHkcomZo1xUpIVKS0bpbNKAoSgH0ERpCoACUAAAFbiS0hW4ktAOxLaQrsS2kAAAAYWc77YhmmHm0XtdiHJ3vs/NCY3Y4LBahBajyaSshscjyPPZ+RxEi52d5W/E6CxQ1x2PS/lXiv8AU0rfdMRWEXTSKsfknJM7y/O9vmFZ2dxzfhdeWLqNBvxAGF10zNZZTNZYXCTtW8ycvLdLl3XUxVdB6AislQAEABFK03oIpWm9CR5ZiW6ZLutpii6TH4Sdq3makK03gVmAOQ6q818Jh15yHVXmvhML4vV5LWbtMVKSFRFOiI1aNkhQD6CNoUAAAAAArcSWkK3EloB2JbSFdiW0gAAAAAEkEEEAImIpI1i0qdh0v5Un1X+ppx60qdh0v5Un1X+pp85m2n2l+zbgA52QAAkC4VsUAD85c515dK01i86td52H2vyr9T5/cPtflX6nz+43+pa05Q03SyqvNNKr3TzrzAyXJcjkZ3b5e/2l1W/E6KQWn0GeZ3zEzWFLprOgch1V5r4TDrzkOqvNfCYTi9Xkmzdrcn3uxTNMLJ97sUzT3ejH/H5pWkAB1oAAAAAArcSWkK3EloB2JbSFdiW0gAAAAAAABE7SNYtKnYdL+VJ9V/qacetKnYdL+VJ9V/qafOZtp9qb/S24AOdkAAJAP9LRorTegACKVpvQRStN6EgBorRbFBAHIdVea+Ew685DqrzXwmGmL1eS1m7W5PvdimaYWT73Ypmnu9D7PzStIADrQAAAAABW4ktIVuJLQDsS2kK7EtpAAAAAAAACJ2kaxaVOw6X8qT6r/U049aVOw6X8q8V/qafOZtp9qb/S24AOdkAAJanqfypfqs9TjjorWp3fNctKzWU7KbG5fa74VgsUiaf9iyH4/mT/AGNscxFq9sxRzkVrURdWp2H2vyr9X50/pH2vyr9X50/pJ+pannDT9LKq800r/af7DrzAyPJcjkJ/b5e/fuq34nRSC7EM8zvmJmsKXTEzoHIdVea+Ew685DqrzXwmE4vV5Js3a3J97sUzTCyfe7FM093ofZ+eVpAAdaAAAAAAK3ElpCtxJaAdiW0hXYltIAAAAAAAARO0jWLSp2HS/lXiv9TTj1pU7DpfyrxX+pp85m2n2pv2bcAHOzABtTeB5z5bpku62mKLpMbg52reZuitN6CKVpvQmJmAAilab0EUrTehAD2CKVpvQRbBdKUL6UqA1P3PyqMIzPk95o+czpfM85xOWj2dxrPj0LFtOg1bkW8uj0qZmV7rap6HU69l+Wl3KnGWlIjWHzIkTJb7zoQhDQZAB7OLFbjt427VrqAALoAAAAAArcSWkK3EloB2JbSFdiW0gAAAAAAABE7SNYtKnYdL+VeK/wBTTj1pU7DpfyrxX+pp85m2n2pv2bcAHOyDkeqXOTmiQVU/KZRtOuOQ6q80T6TPaaYvV5L2btRff/Eu8X3fxLvPvLy2zH3XUQiZHCSte87sXVyZLeVvGlaayuxLzv4l3kvurXeZnCSte8cJK17zT8DN8PvKsO86td5Uc6NK7zL4SVr3jhJWveI6Oav9feVeyQghQD1oiiAABAAAAAAAAAVuJLSFbiS0A7EtpCua6K6FpF11SgQFuuqUXXVKBAW66pRddUoEBbrqlF11SkTtI1a0qdh0v5V4r/U05BWuiuhTsOl0X9qo/uv9TT5zNtPtTfs2wLBahBajnZoch1V5on0me07CC1HIdUtd+6JoXume00xeryWs3a3Kd7sUzDDyjXdrQtCmbddUp7vQ+z80rSgLddUouuqU60IC3XVKLrqlAgLddUouuqUCAt11Si66pQIC3XVKLrqlAgLddUouuqUCAt11Si66pQIVuJLRddUoa10U0LSB/9k=",
    "banner":                 "https://adapunks.io/eternl_banner.jpg"
  },

  "label":                    "ADAPunks Marketplace",
  "caption":                  "",
  "summary":                  "",
  "description":              "",

  "link": {
    "x":                      "https://x.com/adapunksnfts",
    "discord":                "https://discord.gg/WCEhPZT5aF"
  }
}
