{
  "label":                    "ADA Elementz",
  "caption":                  "ADA Elementz",
  "categoryList":             [ "Mints", "Other" ],
  "description":              "",
  "url":                      "https://elementz-fountain.aidev-cardano.com",
  "urlBridge":                "https://elementz-fountain.aidev-cardano.com",
  "image":                    "data:image/jpg;base64,/9j/4QAYRXhpZgAASUkqAAgAAAAAAAAAAAAAAP/sABFEdWNreQABAAQAAAAeAAD/4QOBaHR0cDovL25zLmFkb2JlLmNvbS94YXAvMS4wLwA8P3hwYWNrZXQgYmVnaW49Iu+7vyIgaWQ9Ilc1TTBNcENlaGlIenJlU3pOVGN6a2M5ZCI/PiA8eDp4bXBtZXRhIHhtbG5zOng9ImFkb2JlOm5zOm1ldGEvIiB4OnhtcHRrPSJBZG9iZSBYTVAgQ29yZSA5LjEtYzAwMiA3OS5hMWNkMTJmNDEsIDIwMjQvMTEvMDgtMTY6MDk6MjAgICAgICAgICI+IDxyZGY6UkRGIHhtbG5zOnJkZj0iaHR0cDovL3d3dy53My5vcmcvMTk5OS8wMi8yMi1yZGYtc3ludGF4LW5zIyI+IDxyZGY6RGVzY3JpcHRpb24gcmRmOmFib3V0PSIiIHhtbG5zOnhtcE1NPSJodHRwOi8vbnMuYWRvYmUuY29tL3hhcC8xLjAvbW0vIiB4bWxuczpzdFJlZj0iaHR0cDovL25zLmFkb2JlLmNvbS94YXAvMS4wL3NUeXBlL1Jlc291cmNlUmVmIyIgeG1sbnM6eG1wPSJodHRwOi8vbnMuYWRvYmUuY29tL3hhcC8xLjAvIiB4bXBNTTpPcmlnaW5hbERvY3VtZW50SUQ9InhtcC5kaWQ6Y2VkMTY4MjAtYWVmNi00MzdiLThmYWQtODdhNjllYjAxOTJiIiB4bXBNTTpEb2N1bWVudElEPSJ4bXAuZGlkOkUyQzNBQjM5RkI0NjExRUZCOUJERTUzNzVCMzdCQjAzIiB4bXBNTTpJbnN0YW5jZUlEPSJ4bXAuaWlkOkUyQzNBQjM4RkI0NjExRUZCOUJERTUzNzVCMzdCQjAzIiB4bXA6Q3JlYXRvclRvb2w9IkFkb2JlIFBob3Rvc2hvcCAyNi4zIChNYWNpbnRvc2gpIj4gPHhtcE1NOkRlcml2ZWRGcm9tIHN0UmVmOmluc3RhbmNlSUQ9InhtcC5paWQ6Y2VkMTY4MjAtYWVmNi00MzdiLThmYWQtODdhNjllYjAxOTJiIiBzdFJlZjpkb2N1bWVudElEPSJ4bXAuZGlkOmNlZDE2ODIwLWFlZjYtNDM3Yi04ZmFkLTg3YTY5ZWIwMTkyYiIvPiA8L3JkZjpEZXNjcmlwdGlvbj4gPC9yZGY6UkRGPiA8L3g6eG1wbWV0YT4gPD94cGFja2V0IGVuZD0iciI/Pv/uAA5BZG9iZQBkwAAAAAH/2wCEABALCwsMCxAMDBAXDw0PFxsUEBAUGx8XFxcXFx8eFxoaGhoXHh4jJSclIx4vLzMzLy9AQEBAQEBAQEBAQEBAQEABEQ8PERMRFRISFRQRFBEUGhQWFhQaJhoaHBoaJjAjHh4eHiMwKy4nJycuKzU1MDA1NUBAP0BAQEBAQEBAQEBAQP/AABEIAQABAAMBIgACEQEDEQH/xACUAAACAwEBAQAAAAAAAAAAAAAAAQIDBAUGBwEBAQEBAQAAAAAAAAAAAAAAAAECAwQQAAEDAgQEAwQHBgQHAQAAAAEAAgMRBCExEgVBURMGYSIycYGhI5GxwUJSFAfRYnKCMxWywtJj4ZKiUzQlFkMRAQEAAgIABgEFAQAAAAAAAAABEQISAyExQVEEFBNhgaEyQiL/2gAMAwEAAhEDEQA/APBEmpSqUzmUkBUp1KSEDqUVKSEDqUYpIQPFGKSEDxRikhA6lFSkhA8UJIQPFGKSEDxRUpIQPFCSEDRikhA8UYpIQPFFUkICqKoQgKpjNJMZhAHMpJnMpIBCEIBCEIBCEIBCE0CQmhAIU+n8nq6m01aNFfPlWunl4qLQ0uAcaNqKnOgQRQtclramS6NtctdBB5onSgxvmBIbRjMccarKgSaSaAQhXXV7c3hjdcO1mGNsMdAG0jZg0eUCvtQUIQhAIQhAIQhAIQhAIQhAJjMJJjMIEcyhBzKEAhCEAhCEAhCEAr7V9ozrfmonTaonNh0v0aJT6XnA6gOSoTQCSEIBCEIBCEIBCEIBCEIBCEIBCEIBCEIBCEIBCEIBMZhJMZhAjmUIOZQgEIQgEIQgEIQgEIQgEJqXUf0+lXyF2qniBSqCCE0kAhCYBOAFUCQmkgEITQJCEIBCEIBCEIBCEIBCEIBMZhJAzCBnMpJnMpIBCFJ7Hsdpe0sdycKHHLNBFCFd+Uufywu+mTbklplGLQ4cHUy96ClCEIBCEIBSYx8j2xxgue8hrWjMk5JLq9tQOn3KjGl8jGEsaBU1NG1+KQZ9ysG7eYoXP1zubrlp6G1NAG8/aoWO17huL9FlbvmOFS0eUVNMTkvpTO0LG6mhu9zZ1JImaeiD5TjUa/YvQRQxQMEcLGxsH3WAAfBB8xs/0+3+4GqZsdqOAkdV30NqugP0yuSw1v4w/h5DT619BQg8FN+m9y+ONrb2EOjBaNMRbqFS4F5ri7HNcy6/T3foADD07jOoY6hH/MvqCKIPiV9te47c8svbd8JrQEjyn2OGCntu3t3AyxNeWTsbrj/CaGhDv2r7PNDFPGYp2NkjOBa4VHxXAl7SsbaWa72yPpyys0mEny56jp8SlHyt7HxvdG8Fr2Etc05ghJdPuGF0W4uD2mORzQZGuFCHDDH6FhuLW5tXNZcxOic9rZGteKEsd6Xe9JcilCEIBCEIBCu/KXP5Y3fTItwQ0SnBpceDa5+5VIEhSYx73aWNLnZ0aKnDPJRQCBmEJjMIA5ldEdv7s+1ivIYDNBM3U10RDyPBwGIK5xzK22O47tttTZySQtdiW6asPjpcCEGeSzu4gTLBJGBmXMcB8Quzt/csfTZa71bMv7dg0MkcAZmNy9R9QC1WXfV1DG2K9t+vT1SB5a93iQ6rVsG+dnbh/wCZaCF5zc+Mf44TVBW3tvt7eGmTZrwxSnHoO82n2sdR/wBBKwjZu5dgnNxas60YFJOl8xj2/hkjzp7l1Wdudr3zg/bb3oyDFvTlDiD/AAyUcunBadzbfRrLmLcoBk25DopQOQkGr4orzp23au4o3P2xosd3bjLZPOlj/wARZh9Xv5rz97YXm3zdC8hdDJSoByI5tIwK+kut7XcX/wDsLE21wyhjlJGrVzZPER8VpuLGC5txa3zTMwemR3qB4O1DJ3iqj5Khey3fswHVLZupLpq0EDpyuGYJH9N5GX3SeS85BsO7T3MlrHbO68NBLG4hpbqFW1rz4KDJbwS3M8dvA0vllcGsaOJK+t9uduW2x2ojbSW6fjLOQAakelvJq8v+nuzPF3cbjcxlpt6wRtdg4SH11aeQXt7q6EI0txecvAc0F0kscQ85p4cVmfuDR6W/Sue+VzjVxqSo6lWpo2u3GXgAPcofn56+qnuWWqVUOLX/AHCf8XwU27hLxofcsCNSLxdRm4N++36FpjmjlHkNTy4rhalNkrmEFpoQmEuqXcvbNrvtvXCK9jB6M4Gf7r+YXym7bdR3D4bwvM8Py3B5JLQ3ADHgF9otLoTihweM/FeJ/ULZXfmoNytmVNxSGVjQS50v3aAcwoy8OhdT/wCa3j8yLQwBs7mPkYwuaNYjAc8NxxONF3to7NoGy3jiZdNXNoOnE45AV/qPAz+6DzQeUsrC8v5ujZxOmkzIGQHNxOAXoRtu19uxtfubRfbs7GGyYdTGfhL8Pr93Neyt7GC2tza2LTCw+qRvqJ4u1HN3iVlbb2u3v/8AX2RuZ31MkoI1auck8pPwUyPInZu5d/nFzdM6MZwj6vy2Mb+GOLOnuW09t9vbO0SbzeGWUY9Bvl1fyNq/4hdqe07m3CrX3MW2wHNtsHSynwMh0/Bc1/bna9i4v3K960hxd1JQ0k/wx1cg424dyx9N9ts1sywt3jQ+RrQJnty9Q9IK40dpdygGKCSQHItY4j4BeuO+dnbf/wCHaCZ4ycyMf45sVkve+rqaN0VnB+Xr6ZNZc9viA2jUHIPb+7MtZbuaAwwQt1OMpDCfBoOJK5wzC2324btuVHXkkkzW5NpRg8dLQAsQpXBUdDbN6utrLxAyKRkhBe2VgdlyOYXdh78wpcWII5xv+xwK8kcyuttGwjcojM+8htow7SWucDJh+6SEHoIe8tmmLxd2zmtLvJ8tj/LQerxqr27r2TdGkjIGn/cgLPi1qzRdqdvNaBJeF7qYu60bQT7BkrGdrdtCUudch0ZaAIzO0UdX1agePJFaBtHZl7/RdBX/AGpiw/Q5y2QdvNhJO3bldwhuBa2Rs0YOdNLgQsI7c7PBxkj99yP9S22ew9uxmtpWufy7iT/K9Bsjg3aM6H3UF1hUtliMb6c6xOP1LVGJRQObpHFrXa2+6oBChHZ28MpnjBEzmCJ0jnOe4saahvmJTa+ZslKl7eIwFPeVYL9JFS015/8AFROnMtDXHCtB8HKWonEtJ8afa1QkcKGtW+JBHxUGyzYGxF1ADIS5xpmcqn6FzbmXqTPd44e5dRnlth4M+xcRzsVTXzFUtSshjY9upw1AkimVKKM0QAq1oYBlQnH6VbrZryvk7/juMoalfFE6eECKhkYSXMrQkHIj2LLVMFHGtMsRgh0S4SucCGVqWtAzNOaz1SqlVFmUtSNSttoq6tbQ7kT6aFEts2OPU1xJGdUuZ5zE93ThcZO1nMczXcK4+xda7aHRB9KlhDmnlwqFwWnzBegdjbHxZ9imzlsw+U0IYHOGANBh/Mp6TgXGnAU+xRa+PDp6yABiRU/TRS10xDSPGn2uWGVMrZjUNYXN4Nc7Q330qSsskG7POhl1BailQ2KIyPplWsrh9SvdJO6UtqWNGWTq+8IksreaVs8gJnawxCRrnMcGONS3ykJFc247ebMQdx3K7mDsAx0jYYyc/S0ALI7aOzLI/OdBUf8AdmLz9DXLVebD25Ia3ddWfzLiT/M9Yz272ecGyR18Lof6lURduvZNrhGyBx/24C/4uaqZe8tmhLBa2rnNDvP8tjPLQ+nxqpP7W7aMoc25DYw0gxidpq6uDtRPDkq5e1O3nNIjvNDj6XdaNwB9hzQUTd+YEW9kAP8Acf8AY0BcLc95ut0LBOyKNkZJY2JgbnzOZV277CNtjEzLyG5jLtIa1wEmP7tSuSM1QHMooEzmUkG7aNom3a5NvE9kYY3W97+Da0wHFesg7a7f2yMS3h/Mvq1pMrg1tXEN9AOWPFeGBINQSD4YKUbBJKxjnBge4NMjsmgmmo+AQfR23valmdLH2cbq0pGxrzX+Vriulb3kE7a27JDHwd03Rt/6w1cDbh2vsLai5hfcgeackSSH+EMrpHsXTs99j3In+3QyTxtNHXElIogeQLqucfABVXTLjwafeaLNcNc4eYhvgM1fqIZqe5o5uGAB9pVTn1qIW6v3zl+0pFiuOZjW/MozkACD78VcDRhe01a4cTgshieXE6tTuLjkpCJoZXAgj1OOB9jQrYV3gNUQHNv1hcCQFriDwXfgNYYyOLW/UuZuVsWSGRo8rsVlJcViZM8UYzSMc3FSnkc7Q0EFtPmHiT4KkhC6zsvHj/LrO6zXj/ILg0FxNAMSVn/uEVfS6nNXvbraWnJwosD4yw0eCDz4H2LDnF53CEH0upzWoEGhGIOIXNZEZDpYCeZ4BdFrdLQ0ZAAfQiytcUwDGNaQ3TmCq7icObowJrmMlSlQlbvZnXjZHS9tuuMfulE0ukaOZXoiNMRbybT4Ll7bal0gkcMG4+9dWY0ieTwafqXO1y2rkPPk1vNGNHA4LPNOxzPlUfXMEEnHDDGii+FjmahRoA9TTgD4tKg2GQOBLtLuDhkfauNtRotWOa3Ah3twK1BzuLT7iFna/ThM3SfxjL9oV+o6NTHBw4E4ivKoWp4QVT3kEArcMkDOLum57ffoDlzXXval4dL32cjq0pIxrHV/na0q683yPbSP7hBJBG40bcR0liJ5EijmnwIXM3Edr782puYWXJHlnB6cg/iD6ah7VpEJ+2u39zjMtmRbP1OaDE4ObVpLf6bjl7F5Pd9ol2m5FvK9kge3Wx7OLThiOCySsayV7WuDwxxaHswa4A01D2qJJOJJJ5nFUKgTGaSYzQBzKEzmUkAhCEA3SCKira4gYEheom7yZBbNtdpteixjQ1j5Pu+xjftXl0IPoVjosbL+5b5P8+YmVwefJGXiuiKMYaiM6BdOG6Elib+4AtoCA5rHnz6XejV+878IXy91zM98ckzzMYqBgkJcKNxDceC9Ntm8N3G8l3Ddp2xMswHW1sMGBzqglrTi53AIuXppHumFCDHETRrfvP8Aby9iuzjDjhhSuZ9jVTEXUEkgpNIPLHX0N/D/AKjzS6mgkF3lGGvMlx4NW5Go9BaO1W0R/dCskjZIwscKgrPtrmus4tOQq3nkVqWGHJuNtc01ZiFkMDhmF6JRdHG7NoPuVyPPdIhHSJ4VXeNtA44sHtCX5SDLSpKOEIjlRPpFdwWduPu/FSFtAPuBVcuEIHE4Ba7fbnuNXCjea6jY2N9LQPcpIZQjjZEwMYMAoXRaLeTVXTpNaZ08Fcsm5ODbKUuyIAzpmeal8kcjKMvadQyrkeVHKmJ74BQAywA0c378fs5jwUOqJHAB3ly15EOHByskLgDJGKzRjzR/jby9/wB081ylytTlvGsszeW4/MwsBc5rPUWt9Wiv3m/hK517ovrL+5bHP8+IiVoZ6JCwV0SxHDVyqFx9z3hu3XkV/tM7ZWXgLrm2dizU2gBc0YtdwPFeabcTMfI+F5h6tQ8RktFHZtw4LpIj0cHeTJ7Z1ru1r1mPaWvfHTze1jvsXl3aS40FG1wBxICEKgQhCAQM0ICBnMoTOZSQCEKTCwatTdVWkNxpR3B3jTkgihCEAgYEEZjEFNFEHptg324uLv8AK3MgN1dvZG25lIbHHE0HUKePDmc16B88Jj1wkOja8w25b6XuB06m+GBXzii7my7hCyJ7bu5eyS1Y4bbAGamPllqDqp7VZtjxWXD6Xs0Zj26FpHM151Oa3Kq1jdFawxu9TGNDj40xVql80NCEIGhJNAIQkSAKnggEIBBAIxByQgSx7qWiyeXRiZgIL4yaVbXmFsVc8XWglhrTqMLQRwJGBSjyAuYI4nTTANi1dO4BxEZrSp8MQuDufcR63The5k9qZY23MOlzJWmgjBBw04Y/Bcu/3G+kmuoJHhrZHCOaNo8rjF5QcfYsAaSQ1oqTgAs664W0jmScziT4oTpwRRaQkJ0QgSEIQCAhCBnNCZzQgSE0IEhNFECQnROiCy1mZb3Mc74WXDY3ajDJix/g5dHtlvW7ksqRso6Yu6ZbqY0YnAH8PBcqi9N+n1uZd+MxFW28L3V5OfRgQfTEI4IQNCEIBCE0AkhNAkIQgSAhHBB8k7ntIrfuHcI69JurqRihOovAdTDKtTiuPReu/UW10btb3LW0E8Oku5uYf2LyVECySUqIogihOiECQmhAkJoQMjFFFOiNKCFEUU6IogjRFFOiKIIURRT0qRNWNZpaNJJ1geZ1eDj4cEFVF9A/Ti202N3cn/8AWUMGHBg5+9eD0r6X2I5h7fja31Nlk1jxrX6kHo+CSaSBoSTQCaSEDSQhAIQhAk+CXFOqDyP6iwOftdvO1tRFNRzuLQ4UHxXzyi+o97Fv/wA7cB3F0YHt1L5jpQV0RRWaUtKCFFdb2c9y2Z8LQ5ttGZpiXBtGA0qK5+wKGlGlBCiKKdEUQV0RRToiiCzSjSrtCehBToRpV/TT0IM+hPQr+mn00FGhGhaBGn00GbQu1293BPssjmaOrayGskdaEHLU1c7pqTYS4OcKUYKmpAwJphzQezm7/sGt+RazSupgHUYK+JxU+2e6JNyuJba+0xzvcX24bg3T/wBsV5LxHTTDCCCCQRiCMCi4fXQmvJbH3aXdKz3FpMjiGMnaM+A1hesyRDQkgUGAFBmgaEqoQNJGJyXkt87uIMlptoIIqx9w7AtORDB9qC3ubuk2Esdrt7g+5jeHTkirNI+4fbxUIe/rJ0RNxayMmGTGEOaf5jSi8a5pcS5xq4mpJzJKWhQw3b/v91vb2B7BDbxVLIga1J4uPErkaFp0JaEMM2hGhbIYYHPInkMTNLiHNbrq8Dytp4niqumqKNCWhaNCWhTK4UaEtC0aEtCGFGhLSr9CNCI09FPord0kdJdOLpxYuijpeC2iJSEKs0yzfBhEJ5KQgJ4LeIfBWNhXbT43L1c9uzHo5wtnHgpi0cV0mwqYiIXp1+Dp61xvdt6OaLFymLDmukI1MMHJdJ8Ponplm9nZ7uaNvCkNvYumGgcE6U4LX1+mf4Tl2X1Y7SwjbdQupk9pr7178ZrxjWPcQGDE5L1UE0wib1WgyUGrTl8V4/mdeut1ukk88yO3VyxeTVQLFut5JZWzZomh7i8NLTyKu67vwH6QuXvDLy56Yjo2NhJFK6tS8vXJz15/1z4ulzjwbtrvJL22M0rQxwcW0blQLbguJs0d3a9Rr6GJxBpxB8F1eufwn4J2TXntx/rnwJnHityXgJ7CM3E5LQS578+BJzwXtZ55jE4QtAkp5dWXwXliZY+o2Rgc5+GojFprm1ej4mmu135a8vLwY7Ztj/m4cw7czgoHbRwXSBPJPHkV7b8bpv8Alwz2z1ch23HgoOsXhdsMrwSMS57fD6j8vZPVwTaSBQNu/ku66FUuhC8+/wATWeVanft6uMYXDgo9M8l1XQBVOhXn36bPV117c+jnaEtC2uhUDGuNljrLll6aXTWrR4JaFnK4dPpo6a0aUaF6m2fQmGq7QjQmcJVYCkFLQpNjVnbtGNtNSaVaKpsiV7YsFr7e88nP8cUgV4K1lsX5YK1kOK3W8Iotfd7P0XhGIWR5qbLOpxXS6QQIwCp9zs/Q4RTBasaQaZLoNpRVNbRWBctu7bbxq4TqouAKSFnmG0AJ1UUJzvspupRYpLWJwcSKngthVbgrr27a+M8GdtczDkOtg04BRMB5LqGMEoMQW/s9vucNXGewtzCpcV1p4RRYXw45J9ns90/Hr7MbnBVOctwgB4KiSGhOCze7e+qcNc4wxuKgQTwWl0Sk2IaVz27NvdeOsYC1RLFqfHioFi5W2ukkZtCWhaSxLQstN+lGlToii9bVQ0o0qyiYapaiAYrWxqbWK5jAsWsWoMiVzY1NrArWsCyiDI1qibQKLWhWsognRFE6hKoVDCko1CdQgaEqhOo5oBCVRzRUc0DUSnUc0qjmgVEURUJ1CCiVtQsr41tfRUuaEGXRRUSR4rcWhUvYETHiwOiUQ2gWtzAqnNUqWML2YqBatL24qstWbG55KC1ItVxCRCxVf//Z"
}
