{
  "order":                    0,

  "categoryList":             [ "DeFi" ],
  "keywords":                 [ "Mint", "NFT", "Social" ],
  "trigger":                  [ "handle", "adahandle" ],

  "url":                      "https://v2.liqwid.finance",
  "urlBridge":                "https://v2.liqwid.finance",

  "image": {
    "icon":                   "data:image/jpg;base64,/9j/4QAYRXhpZgAASUkqAAgAAAAAAAAAAAAAAP/sABFEdWNreQABAAQAAAAeAAD/4QMxaHR0cDovL25zLmFkb2JlLmNvbS94YXAvMS4wLwA8P3hwYWNrZXQgYmVnaW49Iu+7vyIgaWQ9Ilc1TTBNcENlaGlIenJlU3pOVGN6a2M5ZCI/PiA8eDp4bXBtZXRhIHhtbG5zOng9ImFkb2JlOm5zOm1ldGEvIiB4OnhtcHRrPSJBZG9iZSBYTVAgQ29yZSA5LjEtYzAwMiA3OS5hMWNkMTJmNDEsIDIwMjQvMTEvMDgtMTY6MDk6MjAgICAgICAgICI+IDxyZGY6UkRGIHhtbG5zOnJkZj0iaHR0cDovL3d3dy53My5vcmcvMTk5OS8wMi8yMi1yZGYtc3ludGF4LW5zIyI+IDxyZGY6RGVzY3JpcHRpb24gcmRmOmFib3V0PSIiIHhtbG5zOnhtcD0iaHR0cDovL25zLmFkb2JlLmNvbS94YXAvMS4wLyIgeG1sbnM6eG1wTU09Imh0dHA6Ly9ucy5hZG9iZS5jb20veGFwLzEuMC9tbS8iIHhtbG5zOnN0UmVmPSJodHRwOi8vbnMuYWRvYmUuY29tL3hhcC8xLjAvc1R5cGUvUmVzb3VyY2VSZWYjIiB4bXA6Q3JlYXRvclRvb2w9IkFkb2JlIFBob3Rvc2hvcCAyNi4zIChNYWNpbnRvc2gpIiB4bXBNTTpJbnN0YW5jZUlEPSJ4bXAuaWlkOkE1NENGQUJGRkIzNzExRUY5MzdGOTI5NUQzMUI2MTIzIiB4bXBNTTpEb2N1bWVudElEPSJ4bXAuZGlkOkE1NENGQUMwRkIzNzExRUY5MzdGOTI5NUQzMUI2MTIzIj4gPHhtcE1NOkRlcml2ZWRGcm9tIHN0UmVmOmluc3RhbmNlSUQ9InhtcC5paWQ6QTU0Q0ZBQkRGQjM3MTFFRjkzN0Y5Mjk1RDMxQjYxMjMiIHN0UmVmOmRvY3VtZW50SUQ9InhtcC5kaWQ6QTU0Q0ZBQkVGQjM3MTFFRjkzN0Y5Mjk1RDMxQjYxMjMiLz4gPC9yZGY6RGVzY3JpcHRpb24+IDwvcmRmOlJERj4gPC94OnhtcG1ldGE+IDw/eHBhY2tldCBlbmQ9InIiPz7/7gAOQWRvYmUAZMAAAAAB/9sAhAAQCwsLDAsQDAwQFw8NDxcbFBAQFBsfFxcXFxcfHhcaGhoaFx4eIyUnJSMeLy8zMy8vQEBAQEBAQEBAQEBAQEBAAREPDxETERUSEhUUERQRFBoUFhYUGiYaGhwaGiYwIx4eHh4jMCsuJycnLis1NTAwNTVAQD9AQEBAQEBAQEBAQED/wAARCAEAAQADASIAAhEBAxEB/8QAmQABAQEAAwEBAAAAAAAAAAAAAAQFAgMGAQcBAQADAQEAAAAAAAAAAAAAAAABAgQDBRAAAQIDBgMHAwQCAwEAAAAAAAECAwQFEXFysjQ1IcHCMYGxEoIkBkFRcyITFCUyM2GRoRURAAIBAgMGAwUIAwEAAAAAAAABAgMEESGyMUFhcYESMkJy8NEiEzNRkcGCwtIUNLHiI5L/2gAMAwEAAhEDEQA/AP0AAAAAAAAAAAAAAAAAAAAAAAAAAAAAAAAAAAAAAAAAAAAAAAAAAAAAAAAAAAAAAAAAAAAAAAyPkdQmJGTYssvliRX+Tz2W+VLFXhaWhBzkoraytSahBzlsia4MX41UZqegRmzLvO6C5ER9iIqo5PrZcbQnBwk4vaiKdRVIKcdkvtAAKlwAAAAAAAAAAAAAAAAAAAAAAAAAAAAAAAAAAAAAAAef+X6SX/L0qas1VJCUiNhTEZsN7uKNW1eH3WzsMr5aqLJy6otqLEtRUwqd7eLVWm2mk3kZ7qUXRqJNNxWa+w6/h/8Arm8TPBx6Q858Q4Q5vEzwcbEvVKfMx3S8CO18Vtv6Ut42dvlXsXuJuYt1ptJvDDH7iLSUVQpptJyxwx35lYAM5pAAAAAAAAAAAAAAAAAAAAAAAAAAAAAAAAAAAAAAAPE/It3j3MyoW1nYqd6chH8h3aPczKhZWNjp3pyHprZb9NJ5D8V311H343oajh6HGZRN0lcfJTT+OaGo4ehxm0XdJXHyUb7jktJHlteb1HugAeYewAAAAAAAAAAAAAAAAAAAAAAAAAAAAAAAAAAAAcIr0hwnxFS1GNV1lyWnnqZ8hnJmfZBjNZ+1GVURGpYrOFqcfqb03pY343eCnjKNucrj5KarenCVOq5LFpZfcYrqrOFWioyaUpZ8c0dnyHdo9zMqFtY2OnenIR/IN2j3NyoW1jZKf6chpWy36aTI/Fd9dQ+O6Go4elxm0XdJXHyU0/juhqGHpcZtF3OVx8lJ33HJaSPLac3rNasV6clJ50vLo1GQkTzeZLVcqp5u5Ddlo378vCjonl/cY19n28yWnkK/u0x6cqHqqbt8t+Jnghlr04Ro0pJYNpYvobLarOVetGUm1FvBfZg8CoAGU2gAAAAAAAAAAAAAAAAAAAAAAAAAAAAAA4ue1jVc9Ua1O1yrYiHIxPlKr/Dgtt/S6JxT72NUvSh3zjDHDuZzrVPl05Twx7VsNSPEZEk4r4bke1YbrHNW1Oxfqh46jbnK4+Smp8eVf4M+239KJaifS1WutMyj7lK4+Sm6lT+XGvDHHBfgedWq/MlbTww7ns5SwOz5Buse5uVCyr7JT/TkJK/use5uVCyr7LT/AE5Cy2W3TSUfiu+uofHtFUMPS4zqNucri5KaXx/RVDD0uM6jblK4uSk77jktJHltOb1nOv7rMenKh6iQexlNl3PcjWpCZa5VsROCHl69usx6cqF1YVf/AIsg239Ko21PvYw51Id9OhDHDuw0nSlU+XVuZ4Y9uOX5j0bHsiNR8NyPavY5q2ovehyMD4oq/szDbf0o9qon0S1OJvmKrDsnKGOOB6NCp8ynGeGHduAAKHQAAAAAAAAAAAAAAAAAAAAAAAAAAA8vXKjOw6g6FCjOhMhI3yo1bLVVLbV+53VyK6PSpKM//N6o51nZarFIa9uke5uVCuq7LIenIp6SjFK3aST/ANTyJTk3dpybS3cpH34/o6hhTK4zaPuUrj5KaXx/Rz+FMrjOo+5SuLkpbfcclpKeW09T1nZX91j3NyoWVbZaf6chJXt0j3NyoV1bZpD05CFstumkl+K766j78f0VQw9LjOo+5SuLkpo0DRT+HpcZ1H3KVxclJ33HJaSPLac3rOde3SP6cqFtY2en3NyEdd3SP6cqFtX2en3NyEbrb28pL23fXWcvjj1hyk7Eb2ssclv3RqqT0ipzz6jDbFjOiMjKqPa7s7Lf0p9DuoOgn8PQ4z6NuUti5KQ4xbuG0nktJKnJRtEpNJt7PUe0AB5p7AAAAAAAAAAAAAAAAAAAAAAAAB8JYFUkZiOsCDFR0ROxLFRFs7fKq9p3TGni4HeB5Gk7hK408DRRoxqQqSba7FlgZbi4lSqUoJJqo8Hj92R2V7dI1zcqFdV2WQ9ORSWu7nGublQrqmzSHpyKa14bbppMD8V311igaOfwplcZ1I3GVxclNGgaSfwplcZ9I3GWxclJ33PJaSPLaep6zsru6R7m5UK6ts0h6chLXdzjXNyoV1XZ5D05CFstumkl+K766xQNHP4elxnUjcZbFyU0qDo5/D0uM6kbjLYuSk77nktJHltPU9Zzru6R/TlQsq+0SFzchJXNzj+nKhZV9okLm5CN1t7eUl7bvrrFB0M/h6HGfR9ylsXJTRoWhn8PQ4z6PuMti5KTvueX6SN1pzes9PM1ORlYqQo8VGvXjZYq2Iv1WzsKkVFRFRbUXsU8hW9zmPTlQ9RT9DL/AI2eCGOtRjCnTmm8ZrP/ACehQuJVK1Wm0kqbyw4PDMoABnNQAAAAAAAAAAAAAAAAAAAIKvPRJKWR8JEWI93kRV7E4Ktv/haEXOSitsitScYQc5bIrFlUxp4uB3geSpO4SuNPA3KbUY07JzKRkTzwmqnmThajmr9DEpW4S2NPA3UIOEK8ZbUvwZ5l1UjUqW047JS/Ujsrm5xrm5UKqps0j6cik1c3ONc3KhVU9nkfTkU6Lw23TScn4rvrrFB0k/hTK4z6TuEti5KaNC0k9hTK4z6TuEti5KN9zyWkjy2nqes7K5uca5uVCqq7PIenITVzc41zcqFVU2iR9OQLZbdNJL8V511ig6Ofw9LjPpG4y2Lkpo0LRz2HpcZ9J3CWxclG+55LSR5bT1PWc65ucf05ULKttMhc3ISVvco/pyoV1baZG5uQbrb28pL23nXWKHoZ/D0OIKPuMti5KaFD0U9h6FIKRuMti5KN9zy/SRutOb1n2tbnMenKh6eQ0Mv+Nngh5mtblH9OVDWmZ+LJUqVWCifuRGtairxRP0222HKtBzpUIx2tL/B3t6kada5nLZFvUbAM+jzsadlnPjInnY7y2t4W8EXs7zQMU4OEnF7Yno05xqQU47JLHMAAqXAAAAAAAAAAAAAAABj/ACTSQvydLjYMj5HpIX5Olx2tvrQ5me8/r1PSS0HTT2FMriCla+WxJ4GhQtPO4UyuIKWnv5bEngbsfiuOS0nl+W09UtZ2Vvco1zcqFVT2eR9ORThWZKafPuiQ4TojIqN8qtS3iiWWL9jurEJ0GmSkJ/8AkxUR1n3RqlVKLVuk03/qdJQkndtppZ5vjI4ULST2FMriClbhLYuSmhQ9LPYUyuIKUnv5bFyLY53HJaSnls/U9Zzre5Rrm5UK6ptEj6chLWtyjXNyoV1PaZH05CFstumkl+K866xQ9JPYelxn0ncJbFyU0KHpJ67pcQUpPfy2LkpOOdxyWkjy2fqes51rco/pyoV1XapG5uQlrW5RvTlQrqu1SNzchGOVt7eUl7bzrrFE0U9d0qQUjcJfFyUvominrulSGkp/YS+LkpOOdzy/SRus+b1n2s7lH7sqFlW2uRubkJKzuMfuyoWVXa5G5Mgxytvbyjfee3nKPjeki/k6WmwZHxzSRfydLTXMNz9afM9Oz/r0/SAAcTQAAAAAAAAAAAAAAADJ+RaWF+Tpcaxk/IdLC/J0uOtD6seZnvP69T0k1D087hTK4gpae/lsSeBoUTTzuFMriCmJ76XxJ4Gvuzr8UtJ5nltPVLWetMj5FpoP5OlTXMj5Dp4X5OlTJQ+rHmenef16nL8SeiaWduTK4hpae/l8XIvoulnbkyuIaWnvpfFyNfdnX4paTzPLaep6znWk/sY1zcqFNT2mS9OQnrKf2Ma5uVCmpbVJenKR3ZUOH7SX4rvrrFE0k7d0uIaUnv5fFyUvoulnbulxDS09/L4uRPdnX4paSPLaep6zlWU/sY3pyoV1Ta5K5uQlrCf2Mb05UK6ntclc3IO7Khw/aS9t511nyi6Kdu6VIaUnv5fFyUvo2jnbulSKlJ7+XxclHdnX4r9JG605vWKwn9jH7sqFlV2yRuTIS1dP7CP3ZUKqptklcmQd2VDh+0nfd+3nKfjuli/k6WmsZPx7SxfydLTWMlf6suZ6Vn/Xp+kAA5GgAAAAAAAAAAAAAAAGV8g0sP8AJ0qapFVJN85LoyGqI9jvMiL2LwssL02lNNnG5jKVGcYrFuOSM+iaecwplcQ0xPfS+JPA2JCQiScrHWKqeeIi/pTiiIiL9TIpqe9l8SeBoU0/mtb/AHHmThKCtYyWDTeXOR6onnZOFOQf2oiqli2tcnainyYqEpLPSHGf5XLxssVbE+62FCKioiotqLxRUMq7o4NYr7Ges3Tqd0G4y3Sj7yKDIwpKUjMYquc9rlc5frwMKmJ76Xxcj1MRvnY5nZ5kVLb0MWRpE1Bm2RIvlSHCW3zItvm+iWIdqdT4Z9zzkYrmg/mUFTh8EHu3Zp5klY3CLc3KhTUtrk+7KT1fcItzcqFNR2uT7sp07sqXD3GZ+K766xRtLOXdLiGmJ76Xxci+jaWcu6VIqYnvpfFyHdnV4+4jy2nN6zlWE/sI3pyoVVPbJK5MpNV9wjenKhTUttk7kyjuypcPcS9t311ij6Odu6VIqWnv5e/kpdR9JOXdKkVLT30C/ko7vq8fcRutOb1n2rJ/YR+7KhVVNtkrkyE1W18buyoacxJRJymyzYSoj2Na5EXsX9NlhDkkqTe73FowlKV3GKxbxy/MfPj+lifk6UNUipcnFlJdzIqp53u81icbOCJ29xacKjTm2j0raLjRhGSwaWwAAodgAAAAAAAAAAAAAAAAADrj/wCmJhd4Hm6cnvZfEngekjf6YmFfA85TtZAxJ4HSDwjI869+tQ9X4o51dPfxbm5UNyR0cDA3wMSra+Lc3wKp2JEZSpZrHK1Ho1HWcFVPLbYTLOMUUo1FTrXM2se3uy/MbIMikRov8aYRXKqQ+LLeNnBVI6bHjfzoaq9yrEWx9q222oU7duew0/zI4Un2v/s8NuzPA+VfXxbm5UKKjtkn3ZToq2vi3NyoUVDbZTuynTu8HAxPxXfXUKPppy7pUipqe9gYuRdSNNN3dKkdNT3sDFyHd4+PuI8tpzes+1ZPfxvTlQpqW2ydyZSeq6+L6cqFNR26UuTKO7wcCXtu+usUjSTl3SpHTE99Av5KW0nSTd3SpHTU97Av5KO7x8fcRutOb1iqp7+N3ZUN+T0kHA3wMKqJ76N3ZUN6T0kHA3wKzeMYmiz/ALNfm9R3AA5nogAAAAAAAAAAAAAAAAAAAAHw6IUjKwYqxYcNGvX6/a37fYoAKuMW02k3HNYrYedquui3N8Cif22U7sqlE7SnTMf91kRG+ZER6KlvZwtQ7pqQbGlWQGO8qwrPIq8exLOJOOzgef8Ax6uNw+3x49ue3PEipOnm7ulSOnJ7yBi5GvLSX8SVjI53me9FV1nZwT6GTT095Axch3beJynCUP4sZLBp5rnI5VXXRbm+CFE/tsp3ZToqmui3N8Cif26V7so7tnAh+K766hSdNN3dKkdOT3kDFyLaVp5q7pUjp6e8gYuQ7tvEjy2vN6zlVU99F7sqFFQ26U7sp0VTXRe7Khovk/5chAYjvK5rWq1V7OyziMdnAvGEpzuoxWLeOH/ompWlm7ulSOmp72BfyNmSkEloL4b3eZ0X/JU4JZZZwOiUpKwJhIroiOaz/BESxVvJx28Tp/Gq4W3w+B/Fns+LErjSMrHekSLDRzk4W/dP+fud6IiJYnYfQVPQUYptpJOW1pbQAAWAAAAAAAAAAAAAAAAAAAAAAAAAAAOMRqvhuana5FT/ALQxpKQmmTUN0RnlaxbVcqpZw+xtgYHGrQjUlCcm8abxWBjVGSmYk06JDYr2vRLFRU+iWcbTvnZOM+Sgw2J5nwrPM1LrOBpAjAp/Ep41HjL/ALbeG/IzqdKRocCMkRPIsXg1Fus+hLIyE0yahuiM8rWLarlVLOH2NsDAfxKeFNYy/wCOzjnjmY1RkpmJNOfDhq9r0SxUVPtZxtNWAxYcGHDd2taiLeiHYCcC9OhGE5zTeNTbiAADsAAAAAAAAAAAAAAAAAAAAAAAAAAAAAAAAAAAAAAAAAAAAAAAAAAAAAAAAAAAAAAAf//Z"
  },

  "label":                    "Liqwid Finance v2",
  "caption":                  "Liqwid Finance v2",
  "summary":                  "Lending and borrowing protocol on Cardano.",
  "description":              "Liqwid is a non-custodial liquidity market protocol for lending and borrowing on Cardano, offering fast, affordable, and transparent liquidity solutions.\nUsers can supply assets to earn yield and also borrow against their collateral while still earning interest on it.",

  "link": {
    "x":                      "https://x.com/liqwidfinance",
    "discord":                "https://discord.gg/PZ3GUWamY8",
    "forum":                  "https://gov.liqwid.finance/",
    "website":                "https://liqwid.finance/",
    "github":                 "https://github.com/Liqwid-Labs",
    "documentation":          "https://liqwid-labs.gitbook.io/"
  }

}