{
  "label":                    "Optim Finance",
  "caption":                  "Optim Finance",
  "categoryList":             [ "DeFi" ],
  "trigger":                  [ "optim" ],
  "description":              "",
  "url":                      "https://app.optim.finance",
  "urlBridge":                "https://app.optim.finance",
  "image":                    "data:image/jpg;base64,/9j/4QAYRXhpZgAASUkqAAgAAAAAAAAAAAAAAP/sABFEdWNreQABAAQAAAAeAAD/4QMxaHR0cDovL25zLmFkb2JlLmNvbS94YXAvMS4wLwA8P3hwYWNrZXQgYmVnaW49Iu+7vyIgaWQ9Ilc1TTBNcENlaGlIenJlU3pOVGN6a2M5ZCI/PiA8eDp4bXBtZXRhIHhtbG5zOng9ImFkb2JlOm5zOm1ldGEvIiB4OnhtcHRrPSJBZG9iZSBYTVAgQ29yZSA5LjEtYzAwMiA3OS5hMWNkMTJmNDEsIDIwMjQvMTEvMDgtMTY6MDk6MjAgICAgICAgICI+IDxyZGY6UkRGIHhtbG5zOnJkZj0iaHR0cDovL3d3dy53My5vcmcvMTk5OS8wMi8yMi1yZGYtc3ludGF4LW5zIyI+IDxyZGY6RGVzY3JpcHRpb24gcmRmOmFib3V0PSIiIHhtbG5zOnhtcD0iaHR0cDovL25zLmFkb2JlLmNvbS94YXAvMS4wLyIgeG1sbnM6eG1wTU09Imh0dHA6Ly9ucy5hZG9iZS5jb20veGFwLzEuMC9tbS8iIHhtbG5zOnN0UmVmPSJodHRwOi8vbnMuYWRvYmUuY29tL3hhcC8xLjAvc1R5cGUvUmVzb3VyY2VSZWYjIiB4bXA6Q3JlYXRvclRvb2w9IkFkb2JlIFBob3Rvc2hvcCAyNi4zIChNYWNpbnRvc2gpIiB4bXBNTTpJbnN0YW5jZUlEPSJ4bXAuaWlkOjAyQzRDRTA3RkIzNzExRUY5MzdGOTI5NUQzMUI2MTIzIiB4bXBNTTpEb2N1bWVudElEPSJ4bXAuZGlkOjAyQzRDRTA4RkIzNzExRUY5MzdGOTI5NUQzMUI2MTIzIj4gPHhtcE1NOkRlcml2ZWRGcm9tIHN0UmVmOmluc3RhbmNlSUQ9InhtcC5paWQ6MDJDNENFMDVGQjM3MTFFRjkzN0Y5Mjk1RDMxQjYxMjMiIHN0UmVmOmRvY3VtZW50SUQ9InhtcC5kaWQ6MDJDNENFMDZGQjM3MTFFRjkzN0Y5Mjk1RDMxQjYxMjMiLz4gPC9yZGY6RGVzY3JpcHRpb24+IDwvcmRmOlJERj4gPC94OnhtcG1ldGE+IDw/eHBhY2tldCBlbmQ9InIiPz7/7gAOQWRvYmUAZMAAAAAB/9sAhAAQCwsLDAsQDAwQFw8NDxcbFBAQFBsfFxcXFxcfHhcaGhoaFx4eIyUnJSMeLy8zMy8vQEBAQEBAQEBAQEBAQEBAAREPDxETERUSEhUUERQRFBoUFhYUGiYaGhwaGiYwIx4eHh4jMCsuJycnLis1NTAwNTVAQD9AQEBAQEBAQEBAQED/wAARCAEAAQADASIAAhEBAxEB/8QAnAABAQADAQEAAAAAAAAAAAAAAAYBAwUCBAEBAAMBAQAAAAAAAAAAAAAAAAECAwQFEAABAwEBDAgFAgYDAQAAAAAAAQIDBBEhMUFRYYGxIkKSFAVxkRIyU3M0BsHRUhNU4UOhYnKCIzPSFSXCEQACAQIBCgYCAwEBAQAAAAAAAQIDBBEhMUFRYXESMlIUgaHBInIT0UKRsWLhIwX/2gAMAwEAAhEDEQA/AMKq2rdFq4wt9T4uZcyi5fEiqnbmf/rj/wDpch7kpRjFyk8EiD7bVMWuykhPzfmM7rVmcxMDWaqJ1Gnj638iTfU5u9hoiwWutlGtlIrj638iTfUcfW/kSbykd7HoYLXWyjWykVx1b+RJvKOOrfyJN9R3sehkFrrZRrZSK46t/Ik31+Y46t/Ik31J72PQxgWmtlGtlIvjq38iTfUcdW/kSb6jvY9DGBaa2UxrZSM46t/Ik31HHVv5Em8o72PRIYFnrZRrZSM46t/Ik3lHHVv5Em8o72PRIYFnrZRrZSM46t/Ik3lHHVv5Em8o76PRIjhLPWyjWykZx1b+RJvKOOrfyJN5R30eiQ4Sz1so1spGcdW/kSbyjjq38iTeUd9HokOEstbKNbKRnHVvjybyjjq3x5N5R30eiQ4Sz1so1spGcdW+PJvKOOrfHk3lHfR6JEcO0s9bKY1spG8dW+PJvKOOrfHk3lJ76PQxw7Sz1spi1cZG8dW+PJvKboObV8K2pMr0wtfrIvWFfQ0wkOBlX2lxmUVbUunxcv5hHXRqqJ2JWf7I/imQ+xL6HXGUZxUovFMo8huW+R/OJ3T8xmVVuMd2GpiRtwr9rORVf62o8x+k473kitbNjQADgAAAAAAAAAAAAAAAAAAAAAAAAAAAAAAAAAAAAAAAB9nKZ3Q18Kotxy9hyY0dcKtL6EdResg8xuksdrOejYv2TX+jOedG3azkVXetqPMfpLXazkVX+tqPMfpKXvLD5F0aAAcJIAAAAAAAAAB06HkVXUoj5f8ABEu05NZU/ladyl5RQ0tisj+49P3JNZeq8hvStak8uHCtb/BDkkTNPy6tqbsMLnN+pdVvWp98XtqpddmlZHkS1y/Ao1B2Qsaa5m5eSKOb0HGZ7bpU780juhEb8zant/lyYJF/u/Q6YNlbUV+kXvyleKWs5i+3+XYpE/u/Q0v9uUq9yZ7VyojvkdgEu2ov9I+GQjilrJ2X25UtuxSskyLaxfifBUcvrKa7NE5G/Ums3rQsQYzsKb5W4eaJVR6cpDArKrlVFVWq6PsPXbZqr1XlOJW8kqqZFfH/AJ4kwtTWTpacdW0qU8uHFHXH8GimnsOcADnLAAAAAAAAAG6i9ZB5jdJY7WcjqL1kHmN0lhtZz0LDlnv9DOeg3bWciq71tR5j9Ja7Wciq71tR5j9JF7yw+RdGgAHASAAAAD6KGhnrp0hhTK963mNxqEm2kli2DxTUs9VKkMDVe9epExquAp+Xclp6OySSyaoS72lTVav8qLpPro6KCihSKBL/AH3r3nrjU3np0LWMPdP3S8kVbMLdvmDIOsoYBkwCMDAMmCQYBkwSQYBkAgwYMgEYHOr+T09Xa+OyGf6k7rl/mT4k5UU01NKsUzVa9OpUxoWZoq6OCsi+1Ml7uP2mrjQ5Li0jP3QwjPyZeM2sjyojgb62imo5lilTKx6XnJjQ0HltNNprBo2AAIAAABuovWQeY3SWG1nI+i9ZB5jdJYbWc9Cw5J7/AEM6mg3bWciq71tR5j9Ja7Wciq71tR5j9JF7yw+RdGgAHASAAAbaWmlq52wQpa965kTCq9BZUVFDQwJBFdwvfhe7GvwPm5Hy3gqb7siWVMyIrrdlt9G/M6D3sjTtPWxD0rWgoLjlzS8kQzIwWrcTGfHLWuvRJYn1Our1HxyOkkuyOV3TeOlywKNo6L6ulZ3pEtxJd0Gh/NKdt5r3ZrNJ8KsPCsKOctBGJ9q84ZghcudDz/3LMMLt5D4JXxRJ2pHI1MGNehD4JeYXbImWJ9Tr/UYzuHDPLwJSbKBvOKdb8b06lNreZ0Tr71b/AFNVCRdUTP7z1zXNBrVVW+tpl30tWJPBtLiOaGX/AFyNd0Ke1RUvkIirbcPpg5nXwf6p3omJV7SdTrS8b9ftB+DHBtLIwcGm9yOtRtXEiphfHcXdU7NNVU9UztwPR6YUS4qdLcB007inU5Xl1aSji0bQZsMG5UwDJgEHz1lJFWQrDLcwsfha7GhJ1NPLTTOhlSx7Fu4lTGhZPeyNvbkcjGfU5bE/icDndZy+qa1IlV87FsSREsb2cKLbfOG+pwa4sUprRrRpTbzaDjgA801AAAN1F6yDzG6Sw2s5H0XrIPMbpLDaznoWHJPf6GdTQbdrORdd62o8x+ktNrORdd62o8x+ki95YfIujQADgJB1OQUCVdZ9yRLYaexzsrtlpyyv5ZBwPL44kSyaRPuSriV15MyG9tT46ixzRyv0DeGU+2adGXG3X/wTpPiernr2nLauM2Khiw9XAybxNKtMK02q0wrSuBBpVpz66vZTqscdjpsOJv6m3mldwzfsxL/nel1foavxU4KrbfvnHc1+F8EM+l6theMdLMvkfI5XvcrnLhUwAcJcAAAAAAHuGaWCRJIXqx6XnJcPACeGYFLy/n0M6JHVqkU313mO/wCKnVRUVO0ioqY0VFQhRaqJZatmI7Kd9OKwkuPbmZVwRX1XNaGltR8qOemwzWX5HIqfcdQ+1tMxIU+p2s75IccFKl5VnkT4F/n8hQW89zTzTv7cz3SOxuW08A7nJ+QrN2amtSyG+yJbivyuxNMYQnUlgsrelljjOgmbCydzFSKRVRj1S45W37DwWnNqNKrl0kLGp2o07cKIl5WYEzXCLLVqLpSSxxxWf+wAAZA3UXrIPMbpLDazkfResg8xuksNrOehYcs95nUzrcbdrORdd62o8x2ks9rORld62o8x2ki95IfIujQADgJPo5fBxNZFCt5zrXf0pdUrlurbjOB7ciR1TLKv7bLE6XKUFh6djDCm5dUvJFJ58DzYLDIsOsoebDTVTMpoHzvvMS4mNcCG+w4fuGotfHStW41O2/pXu/wMq9T66blpzLeyYrFnIllfLI6WRbXvW1V6TyAeM9pqAAAAAAAAAAAAAAADKNVVRqJaq3ERL6mCo5LyplLGypmS2pelrbf20XFlNKNKVSWCyLS9gNfKeRNh7NTWtR0l9kK3UbldlyHbtPNpm09WnSjTjwxX/SMT0i2KRPNKbha+aFO6jrWf0u1kLS0nPdEXZqYZk/cZ2V6WL8lML2GNNS6X/ZJxAAeaDdResg8xuksNrOR9F6yDzG6Sv2s56Fhyz3mdTOtxt2s5F13rajzH6S02s5F13rajzHaSL7kh8i0TSADgLFF7bZZSzSYXSInUn6nXOd7eT/zbccjvgdKw9i2WFGG7H+Sks7PNhiw9WA2K4Hmy24SPMpfvV08mDtqidDdVNBX3ruK71EQ9bXKuNVU4b+WSEdrZaCzmAAeeXAAAAAAAAAAAAAAAPcDUdPG115XtRehVLhVuqQrVsci4lReoubbbuO6d9h+/gVloPVpm08GbTuIPVpxvc7LaSF/0yKm8n6HYtOZ7iS3ltuKRvxMblf8AjPdj/BKZLAA8gsbqL1kHmN0lftZyQovWQeY3SV+1nPQsOSfy9DKpnRt2s5F13rajzHaS02s5F13rajzHaSL7lh8i8TSADgLFT7dW3ltmKR3wOnYcf2w+2kmZhbIi7yfodmw9e2eNGG7D+CrR5sMWHoWGxB5stuY7hDOSxypiVU6i6RLqEPO5HTyObeV7lToVThv/ANPEmOk8AA4CwAAAAAAAAAAAAAABliWuRMaohb3rmK51Ehy6L71dBHg7aKvQ3WXQV1t209CwjknLakUm8x6B5tM2ncVxPVpzfcK/+bZjkb8TonI9yPspYY8LpFWzoT9TG5eFGe7D+SyzonQAeOXN1F6yDzG6Sv2s5IUXrIPMbpK/azno2HJP5ehlUzo27Wci671tR5jtJabWcjK71tR5jtJW+5YfL0LxNAAOAsdv2vKjamaFf3GdpOli/JSjIvldTwtfDMvdR1j/AOl2quktlSw9KynjTcel/wBg82GLD1ZdOJzbnrYe1TUTkdJefMl1G5G5cpvUqxpx4pP/AKRgbOc81jpo3U0K9qpeli2ftot+3KS5lXKqqqraq3VVb62mDyq1WVSWLyLQiQADMAAAAAAAAAAAAAA9RRvlkbFGlr3rYiBZcgOv7ep1V8lU5LjU7DOle9/A7lpopYWU0DIGXmJdXGuFTcins0Kf101HTne9mUniz1aDFotNSD1aT/uOXtVMUSftstXpcp30urYmEka+fiKyWZLznWN/pS4hyX08Kaj1S8kXhnxPnAB5hc3UXrIPMbpK/azkhResg8xukr9rOejYck/kZVc63GzazkZXetqPMdpLNe9nI2u9bUeY7SVvuWHy9C8dJoABwFgWnKaxKrl0cz3a0adiVVwKzCua6RZ7bPM2F8DXqkUior2Jecrb1prRrOlJvDHFZv6B2ecc+WbtU1EtkV58qXFfkbiacMHuGCed3YhY6R2JqWlZznUli8rehA8A7FN7cqH2OqXpC36W6zvkdel5VQ0tisiRz0236y/I2p2dWeVrgX+vwVc1vJCxUS2xbMYLpURydlURUxKiKhyuYchgnRZKREim+i8x3/FS9SxnFYxfHszMKaJoHuaGWCRY5mKx6X2uuHg42sMj0FgAAAAAAAemRvkcjGNVzlwINgPKJad7lVDwzfvSp/neliJ9CfNTVQ0DKdUkksdNgTA39ToI47rahwvjnn0LUUlLQjcjjKKaUcekcdmJQ3WmUU1sRz17LUtXEh9sMCMsV11/8E6C2JKWJ8PM5+B5fJKq2TSJ9uJMSuvrmQkTqc/r0q6z7ca2w09rW5XbTjlnlXNTjqPVHIvU1SwyAAGAN1F6yDzG6Su2s5I0XrIPMbpK7azno2HJP5ehlVzrcbdrORld62o8x2ks9rORld62o8x2krfckPkXjpNIAOAsAAAdjklHy+pa5ZkV88a2rGq2N7ONLL5342Rxt7EbUYxNlqWJ/AjaaolppmzRLY9i2piXIpWUdXFWQJNFc+tmFrsSnpWM4NcGCU1p1oyqJ59B9FpkwDuMzJkwAWxNVTS09WzsVEaPTAq3FTodgONVe23Wq6klRUwMkuLvId4yY1LenU5ll1rOSpNEbPyyvp/9sD0TGidpOttp8yotthdotl48yQwy/wCyNrulDllYL9ZvxRfj2ENYq3ktNjaeZ95i57mkrncso3XmKz+lyoancngW9I9OpSnYy14jj2E/Fy/DK6xPpbf6z7omRQt7MbUbjXCvSp0P+mZgmduoek5OzDM7dQ1hbuOaPiQ22fEjz2jz7m8rp233Pdns0G9lJSs7saW41u6TZQlpIwOdG2SRbI2q7ovH2RULluyusT6W3+s+zBYl7EC6jrJSRhjGRp2WJYhz+ecy4Km+1GtlTMio2y+1t5XfI+mtrYaGBZ5buBjML3YkI2qqZaud08y9p71zImBEyIc11XUFwR5peSLo1AA80kAAA3UXrIPMbpK3azklResg8xukrU72c9Gw5J/L0MaudG7azkZXetn8x2kstrORtd62fzHaSL7lhvLx0mkAHnlwAAAb6Ktmo5kliXI9i3nJiU0AlNppp4NAsaOsgrIvuwre77F7zVxKbyMp6mamlSWFytenUqYlKPl/OKersZJZFP8ASq6rv6V+B6lvdxn7Z+2XkzGUGsqyo6IMGTrKYmQYAJMmTABJkyYBBJkyYAGJkyeTPQQSZNFZWwUUP3Zlv9xid564kPk5jzqno7Y47JqhNlF1Wr/MvwJipqp6qVZp3K969SJiRMByV7qMPbD3S8kXSPddXT106zTLkYxLzG4kPnAPMbbbbytlgAAAAADdResg8xukrU72ckqL1kHmN0lbtZz0f/n8k9/oY1c63G3azkbXetn8x2kstrORtd62fzHaSL7lhvLw0mkAHnlwAAAAAAAADo0XO6qmRGSf54kwOXWTocdul5rRVViNk7D12H6q9d5STB0UrurTyY8cdUvyVlBPYXBkjqfmFbTXIZnI36V1m9Sn3xe46ltyWJkmVLWr8Tshf0nzJx80Zum9GUogcdnuOlXvwyN6FR3yNqe4OXLf+4n9v6myuaL/AHj45COCWo6gOYvuDlyYZF/t/U1P9yUqdyF7ulUb8yHc0V+8fDKSoy1HZCE5L7lqXXIYmR5VtcvwPgqOY1tTcmmc5v0pqt6kMZ31NcqcvJFlB6Smqub0NLaj5O3In7cesudbyHDrue1dSisi/wAES4GrrKmVxzAcdW6qTyY8K1L8l1FIAAwJAAAAAAAAAN1F6yDzG6St2s5JUXrIPMbpK1O9nPRsOSe8xq51uNq97ORtd6yfzHaSxW+pKc1gWGvmRbzndtq40ddIvl7Iv/ReGdnxgA88uAAAAAAAAAAAAAAAAAAAAAAAAAAAAAAAAAAAAAAAbqL1kHmN0lYnezkxyyFZa6JEvNXtuXEjbpTpfTpPSsF7JvXIxrZ1uNq31Pj5hy+OujRFXsSs7j/guQ+xUW1bgsXEdMoRlFxksUwngSk/Kq+FbFhVyYHM1kXqNPBVngSbqljYuIa2U5XYwxyTfkW49hHcFWeBJuqOCrPAk3VLDWymdbKR2EOt+Q+zYR3BVngSbqjgqzwJN1Sw1so1so7CHW/IfZsI/gqzwJN1RwVZ4Em6pYa2UxrZR2EOtj7HqJDgqzwJN1RwVZ4Em6pX62Ua2UdhHrY+x6iQ4Ks8CTdUcFWeBJuqV+tlGtlHYR62R9j1IkOCrPAk3VHBVngSbqlfrZRrZSewj1sfY9RIcFWeBJuqOCrPAk3VK/WyjWyjsIdch9r1IkOCrPAk3VHBVngSbqlfrZTGtlHYQ65D7XqRI8FWeBJuqOCrPAk3VK7WyjWyjsIdciPtepEjwVX4Em6o4Ks8CTdUrdbKNbKOwh1yH2vUiS4Ks8CTdUcFWeBJuqVutlGtlHYQ62PtepElwVZ4Em6o4Or8CTdUrdbKNbKOwh1sfa9SJLg6vwH7qmyHlldK6xIlamFz9VE6yp1sphUdiUlWENM5Mfc9R8lDQR0Uaoi9uR3ff8EyH1pfQWLiCItqXDrjGMYqMVgloMm23iz/2Q=="
}
