{
  "categoryList":             [ "DeFi" ],
  "keywords":                 [ "DEX Aggregator", "Aggregator", "Swap" ],
  "trigger":                  [ "dexhunter" ],

  "url":                      "https://eternl.dexhunter.io",
  "urlBridge":                "https://eternl.dexhunter.io",

  "image": {
    "icon":                   "data:image/jpg;base64,/9j/4QAYRXhpZgAASUkqAAgAAAAAAAAAAAAAAP/sABFEdWNreQABAAQAAAAeAAD/4QMxaHR0cDovL25zLmFkb2JlLmNvbS94YXAvMS4wLwA8P3hwYWNrZXQgYmVnaW49Iu+7vyIgaWQ9Ilc1TTBNcENlaGlIenJlU3pOVGN6a2M5ZCI/PiA8eDp4bXBtZXRhIHhtbG5zOng9ImFkb2JlOm5zOm1ldGEvIiB4OnhtcHRrPSJBZG9iZSBYTVAgQ29yZSA5LjEtYzAwMiA3OS5hMWNkMTJmNDEsIDIwMjQvMTEvMDgtMTY6MDk6MjAgICAgICAgICI+IDxyZGY6UkRGIHhtbG5zOnJkZj0iaHR0cDovL3d3dy53My5vcmcvMTk5OS8wMi8yMi1yZGYtc3ludGF4LW5zIyI+IDxyZGY6RGVzY3JpcHRpb24gcmRmOmFib3V0PSIiIHhtbG5zOnhtcD0iaHR0cDovL25zLmFkb2JlLmNvbS94YXAvMS4wLyIgeG1sbnM6eG1wTU09Imh0dHA6Ly9ucy5hZG9iZS5jb20veGFwLzEuMC9tbS8iIHhtbG5zOnN0UmVmPSJodHRwOi8vbnMuYWRvYmUuY29tL3hhcC8xLjAvc1R5cGUvUmVzb3VyY2VSZWYjIiB4bXA6Q3JlYXRvclRvb2w9IkFkb2JlIFBob3Rvc2hvcCAyNi4zIChNYWNpbnRvc2gpIiB4bXBNTTpJbnN0YW5jZUlEPSJ4bXAuaWlkOjZENDVENTRERkIzNzExRUY5MzdGOTI5NUQzMUI2MTIzIiB4bXBNTTpEb2N1bWVudElEPSJ4bXAuZGlkOjZENDVENTRFRkIzNzExRUY5MzdGOTI5NUQzMUI2MTIzIj4gPHhtcE1NOkRlcml2ZWRGcm9tIHN0UmVmOmluc3RhbmNlSUQ9InhtcC5paWQ6NkQ0NUQ1NEJGQjM3MTFFRjkzN0Y5Mjk1RDMxQjYxMjMiIHN0UmVmOmRvY3VtZW50SUQ9InhtcC5kaWQ6NkQ0NUQ1NENGQjM3MTFFRjkzN0Y5Mjk1RDMxQjYxMjMiLz4gPC9yZGY6RGVzY3JpcHRpb24+IDwvcmRmOlJERj4gPC94OnhtcG1ldGE+IDw/eHBhY2tldCBlbmQ9InIiPz7/7gAOQWRvYmUAZMAAAAAB/9sAhAAQCwsLDAsQDAwQFw8NDxcbFBAQFBsfFxcXFxcfHhcaGhoaFx4eIyUnJSMeLy8zMy8vQEBAQEBAQEBAQEBAQEBAAREPDxETERUSEhUUERQRFBoUFhYUGiYaGhwaGiYwIx4eHh4jMCsuJycnLis1NTAwNTVAQD9AQEBAQEBAQEBAQED/wAARCAEAAQADASIAAhEBAxEB/8QAlAABAQADAQEAAAAAAAAAAAAAAAEEBQYDAgEBAAMBAQEAAAAAAAAAAAAAAAIDBAEFBhAAAgECBAQDBQUIAgMAAAAAAAECAwQRMVFxIUESBWEyQoHBIlITkdFyFAahsWKCIzNTJOFD0hU1EQEAAgIABAYBAwUBAAAAAAAAAQIRAyExQRJRYXGBkQQTQlIz8KGxMnIj/9oADAMBAAIRAxEAPwDnm3i+LHU9WJZvch9C89ep6sdT1ZABep6sdT1ZABep6sdT1ZABep6sdT1ZABep6sdT1ZABep6sdT1ZABep6sdT1ZABep6sdT1ZABep6sdT1ZABep6sdT1ZABep6sdT1ZABep6sdT1ZABep6sdT1ZABep6sdT1ZABep6sJvFcWQsc1uAlm9yFlm9yAAAAAAAAAAAAAAAAAAAAAAAAAAAAAAAAAAAAAAAsc1uQsc1uAlm9yFlm9yAAAAAAAAAAAAAAAFcZJKTTUZY9LeTw0IAAAAAAAAAAAAAAAAAAAAAACxzW5CxzW4CWb3IWWb3IAAAAAAAAAAAAy+29vnf3KprhSjxqz0jpuzHo0atxVhRox6qk3hFe9+B2VhZUrG3jQp8XnUn80tSvbftjEc5FrWNpWtlazpr6MVhBLg4Yc4vU5juXaLiwbmv6ts8qq5eE1yOuDSaaaxTWDT4ppmel7VnhxjwHBA3vc/0+1jXsFis5UOf8n3GiybT4NcGmaq3i0Zj4AAEnAAB0AAAAAAAAAAAAACxzW5CxzW4CWb3IWWb3IAAAAAAAAAAN5+n+19clf14/BF/wBCL5tev2ciN7RWMyM7svbPyVH61Zf7NVcf4I/LvqbMAyTMzOZ6gADgGJedqsbx9VWn01H/ANkPhl7dfaZYEZjlwHO1/wBMV44u3rRqLlGa6X9qxRivsHdFlSi9pxOsBZG68eEjlI/p/uks4QjvNe495fpm7VFyVWEqq4qmsUn4dTOkAndfy+BwlSE6c5U6kXCcXhKMuDR8nZX/AGy2v4YVV01UvgqrzR31Ry192+5sanRXj8L8lReWWz18C6myLcOUjGABYAAAAAAAABY5rchY5rcBLN7kLLN7kAAAAAAAB7WtrVu68Leivilm+UVzk9hM44yMjtPbZX9f4sVb08HVlrpBbnXpRilGKUYxWEUsklyPG0taVpbwt6K+GOb5yfOT3PYyXv3Tnp0AAEAAAAA87mvG3oyqyTklyWoxM8I5yTOOMvQGvs+6QqydO4wpzb+GXpfgbAlas1nFowjW0WjMAAIpB81aVKtTlSqxU6cs4vI+gBzHc+xVbXGtbY1bdcXHOcF70ak701Hc+w07jGvaYUq+coZQn/4supu6W+RzIPqpTqUqkqdWLhUjwlGSwaPk0AAAAAAFjmtyFjmtwEs3uQss3uQAAAAAAHW9lsKdnaqpip1q6Up1I8VhyjF+ByRm9u7pcdvlhD46Dfx0nlvHRle2trVxE+3iOwB4Wd7b3tL6tvLHDzQfmi9JI9zKAAAAAAGk001inwaeQAGqu+0PFztuK/xvl+FmLGrf2/wJ1IJelp4ftN+XF6l0b5iMWiLx5qp0xM5rM0nyaztt5c1Krp11KalxU8PK1yNkXFkK7Wi1sxXt8oTrWaxiZ7vUABFIAAGLf9utr+n01VhUXkqrzR+9eBy19265sKnTWWMH5Kq8svufgdmfNSlTrU5UqsVOnLhKLyZOmya+ceA4QGZ3W1trS8lRtpucV5ovj0P5ceZhmqJzETHUAAdAsc1uQsc1uAlm9yFlm9yAAAAAAAAAelC4rW1VVqE3Coua5rRrmjp+2d6o3uFKrhSufl9M/GL9xyg8eeeJC+uLeU+I70HP9s/UDjhQv3jHKNfmvx67nQRlGSUotSi+KaeKa8GZrVms4kAARAAAAAAAAAAAAAANd3nuisaP06Txuaq+D+BfO/cZN/e0rG3lXqcXlThzlLQ46vXq3Fades+qpN4t+5eCLNevunM8o/uPNtttt4t8W3m2ADUAAAFjmtyFjmtwEs3uQss3uQAAAAAAAAAD2tbS4vKn0reDlL1PKMfxMlzbV7Wq6VxBwmsscmtYvmjndGcZ4+A8jqOw3CVvG0k+MV1U/FPi0cul1NR1eBtouUGnB4OOGDWawOzri9Zj4lTt2dk1/u6cGBad0p1Eqdw1Cp8/pl9xnrisVlqY7VtWcWjCytq2jMSAAikAAAAAAAAHzVq06NKVWrLppwWMm9D6OW733T85V/L0X/rU3mv+yS57LkSpSbTiPcYvcb+pf3Dqy+GnHhSh8sfvfMxQDXEREYgAAdAAACxzW5CxzW4CWb3IWWb3IAAAAAADYdo7dT7hWlGpU6IUkpSgvNJN8tDXmT267dne0q/pT6an4JcGRvE9s45jsaFCjb0lSoQUKa5L971Pm5taF3SdK4gpw5axesXyPVNPininxTXNAx56jmLrstWyrxqKX1LbHhLKSfKMkQ2Xea3VVhQXoXVLeX/BrT0NGZ1xNucse+2b48OAetG5r0P7VRxXy5x+xnkCyaxPCYifVTEzHLgz4d4uV54wn9q/cff/ALqp/hj9rNaCudGr9qz82z90s6fd7uXCKjBeCx/eZvbFWqU5XFabnKbwji+CitDSpOTUVm+C3Z0tKmqVKFNZQSRT9itKVitYiJt/iFuibWtmZmcPoAGVpADxvLmFpbVLiXoXwrWT4RX2jyganv8A3ToTsbd/G/78l6U/Qt+Zzx9pVa9SUvNUm3KT8W+LPaNlN+aSX7Tbr14jER6yja9a85wxgZf5Ff5P2Hy7GfpmnvwJ9s+CP5tf7mMD0nb1oZxxWq4nmRwnExPKYn0AAHQsc1uQsc1uAlm9yFlm9yAAAAAAAAAdV2C8/MWKpTeNW3+B+MfSzZSkoRcpcIxTbfgjkezXn5S/g5PClV/p1Pb5X7GdB3ev9OiqK81TzfhX3ma2vOztj9X9Sja3bWbT0amtVdarOq85tv2cj4AN8RERER0efM5nIADoAGyse1ueFW5WEM408m/xEL7K0jMpUpNpxDz7bZ1KtWFeSwoweOL9TWhuyJJLBcEuCSBg2bJvbM+zbrpFIxHuAAgmHP8A6mu8ZUrOL4L+pUXi+EUdBilxbwS4t6JHJTUru7qXlXKcm6cX8q4R/YW6Kd1/+Ub3isZlLWk6dPF+aXHZcj2HiD0IjEYYLWm0zM9QABwPGtSt55uMZfMmjErVak5tSfBPDpPPBFc38mqmiYxPdj0fVSHRLDFSXJrifIBBfAWOa3IWOa3DpLN7kLLN7kAAAAAAAAAYY8NTbzq1a3TKs8aijGLf4Vga+0pddTrflhx9vIzidK/q+GX7F+MVjpxkABYzhYxlKSjFOUpcElmz7o0ateoqdKPVJ/Ylqzd2djStY4+aq/NP3Iq27q0jHO3gs16pv5R4vGx7bGjhVr4Sq5qOaj97M8Aw2ta05tOWytYrGIAARSAABj9wq/Ss6jXmkuhfzcDn/A2H6iu3RhRpRWLm5Sfs4I0Eruu/VhsjZ9eYrTPW0qNuu17cMYiOrPBr1c11637cD1p3sspx6nycfuL++FU/XvHhPo9K9yqb6IrGfN8kY/5uvqtsDybbbbzeZCE2merRXVSIxiJ9X1OfXLqaSbzwyPkAinEYAAHQsc1uQsc1uAlm9yFlm9yAAAAAAAceQPe0pddTrflhludiMzhG1orWZnoy6NNU6ahzze59gF0cGCZmZmZ6gADjddolTdq4xSU4vCpq9GZxou23CoXKUnhCp8MtPBm3neWkPNWjsnj+48/drmNk4iZ7uLbqvE0jMxGOD2Bhy7tZxycpbR+8lDucK9eNGFNpS9Ta4YLHkR/HfEz2ziEvyUzjPGWaACCYAANB32jGveLGTX04JJLLjxNZ+Rj87+w2Hcrim+41qbeEotRWOT4I8T0NVY/HX0ZNmzZW0xnEZ4ejwVnSWeL9p6whCCwhFR2PoFkREdFVr2nnMvipRp1V8S46rMwq1CdJ8eMXlI2BJRUk4yWKeaOWrEp69s14c4asHpXoulPD0vjFnmVTwbImJjMdQAB0LHNbkLHNbgJZvchZZvcgAAAAAANlRp/TpqPPN7swraHXWjjkuL9hsCykc5ZfsW5V9wAE2cAAAAADN7RHG8x5RjJ+4wjZdljjUqy0il9rKt84129MfKzT/JX1z8NsADz24AAHHd4/+pc/j9yJaV2/6U3i/S/cevfY9Pda/wDF0y+2KMCMumSks08TbrnFaz5QhekWrMS2gMCpdVZvg+haL7z5jXrReKm/bxRb+SGePr2xzhsQeNO5jKlKbWEoLFoxvzdfHHFbYcDs3hGum856Y8WZXpqrTcfUuMX4mtM6jdQqNRn8MuWjMa5h0VpJZPivaRvieMLtPdWZpaMdXkACC8LHNbkLHNbgJZvchZZvcgAAAAAHGXYx88tkZR4Wawo7tnuXVjhDFtnN7fAADqsAAAAADa9kXw1n4xRqjcdmWFCo9Z/uRT9mf/KfWFuj+SPdsAAYG0AAHM/qWk43tOryq08PbB4GoOn/AFJb/Uso11nQnx/DPgzmDVqnNI8uAAAsFTaxw55kAAH1Kcp4dTxaWGPPA+QHMAADoWOa3IWOa3ASze5CtPF8GOl6MCAvS9GOl6MCAvS9GMHowM60/sLdnseFnj9HDDKTMjB6F1eUMGz/AHt6oC4PQYPQ6ggLg9Bg9AIC4PQYPQCG77Ov9R/jfuNLg9Dd9oT/ACf88ij7P8fuu+v/AL+zMBcGMGYWxAXBjBgedalCvSnRn5akXF+04irSnQqzo1PPTk4y9h3eBof1H29ySvqUcXFKNZLT0y9mTLdN8WxP6v8AI58FwejHS9GaRAXpejHS9GBAXpejHS9GBAXpejHS9GBCxzW46Xowk8VwYH//2Q==",
    "banner":                 "https://storage.googleapis.com/dexhunter-images/public/eternldappbrowserdh.jpg"
  },

  "label":                    "DexHunter Aggregator",
  "caption":                  "",
  "summary":                  "",
  "description":              "",

  "link": {
    "x":                      "https://x.com/dexhunterio",
    "discord":                "https://discord.com/invite/TjS72s84tV",
    "medium":                 "https://dexhunterio.medium.com/"
  }
}
