{
  "label":                    "Nucast.io",
  "caption":                  "Nucast.io",
  "categoryList":             [ "Tools", "Streaming" ],
  "trigger":                  [ "nucast" ],
  "description":              "",
  "url":                      "https://app.nucast.io",
  "urlBridge":                "https://app.nucast.io",
  "image":                    "data:image/jpg;base64,/9j/4QAYRXhpZgAASUkqAAgAAAAAAAAAAAAAAP/sABFEdWNreQABAAQAAAAeAAD/4QMxaHR0cDovL25zLmFkb2JlLmNvbS94YXAvMS4wLwA8P3hwYWNrZXQgYmVnaW49Iu+7vyIgaWQ9Ilc1TTBNcENlaGlIenJlU3pOVGN6a2M5ZCI/PiA8eDp4bXBtZXRhIHhtbG5zOng9ImFkb2JlOm5zOm1ldGEvIiB4OnhtcHRrPSJBZG9iZSBYTVAgQ29yZSA5LjEtYzAwMiA3OS5hMWNkMTJmNDEsIDIwMjQvMTEvMDgtMTY6MDk6MjAgICAgICAgICI+IDxyZGY6UkRGIHhtbG5zOnJkZj0iaHR0cDovL3d3dy53My5vcmcvMTk5OS8wMi8yMi1yZGYtc3ludGF4LW5zIyI+IDxyZGY6RGVzY3JpcHRpb24gcmRmOmFib3V0PSIiIHhtbG5zOnhtcD0iaHR0cDovL25zLmFkb2JlLmNvbS94YXAvMS4wLyIgeG1sbnM6eG1wTU09Imh0dHA6Ly9ucy5hZG9iZS5jb20veGFwLzEuMC9tbS8iIHhtbG5zOnN0UmVmPSJodHRwOi8vbnMuYWRvYmUuY29tL3hhcC8xLjAvc1R5cGUvUmVzb3VyY2VSZWYjIiB4bXA6Q3JlYXRvclRvb2w9IkFkb2JlIFBob3Rvc2hvcCAyNi4zIChNYWNpbnRvc2gpIiB4bXBNTTpJbnN0YW5jZUlEPSJ4bXAuaWlkOjZENDVENTQ1RkIzNzExRUY5MzdGOTI5NUQzMUI2MTIzIiB4bXBNTTpEb2N1bWVudElEPSJ4bXAuZGlkOjZENDVENTQ2RkIzNzExRUY5MzdGOTI5NUQzMUI2MTIzIj4gPHhtcE1NOkRlcml2ZWRGcm9tIHN0UmVmOmluc3RhbmNlSUQ9InhtcC5paWQ6M0RGNTYzMDRGQjM3MTFFRjkzN0Y5Mjk1RDMxQjYxMjMiIHN0UmVmOmRvY3VtZW50SUQ9InhtcC5kaWQ6NkQ0NUQ1NDRGQjM3MTFFRjkzN0Y5Mjk1RDMxQjYxMjMiLz4gPC9yZGY6RGVzY3JpcHRpb24+IDwvcmRmOlJERj4gPC94OnhtcG1ldGE+IDw/eHBhY2tldCBlbmQ9InIiPz7/7gAOQWRvYmUAZMAAAAAB/9sAhAAQCwsLDAsQDAwQFw8NDxcbFBAQFBsfFxcXFxcfHhcaGhoaFx4eIyUnJSMeLy8zMy8vQEBAQEBAQEBAQEBAQEBAAREPDxETERUSEhUUERQRFBoUFhYUGiYaGhwaGiYwIx4eHh4jMCsuJycnLis1NTAwNTVAQD9AQEBAQEBAQEBAQED/wAARCAEAAQADASIAAhEBAxEB/8QAjAABAQACAwEAAAAAAAAAAAAAAAEGBwMEBQIBAQEBAQAAAAAAAAAAAAAAAAABAgMQAAIBAgMGAwUCCgcJAAAAAAABAgMEERIFITFRcTIGQRMHYYGRIhShsrFCUmLCI1NzNRbRcoIzQ3Q28MHhkqIkNBVVEQEBAAIDAQAAAAAAAAAAAAAAAREhMUFRAv/aAAwDAQACEQMRAD8AweUpZnte/iTNLixLqfMh0Rc0uLGaXFkAFzS4sZpcWQAXNLixmlxZABc0uLGaXFkAFbb3sgAAAAAAAAAAAAAAAGLW4AC5pcWM0uLIALmlxYzS4sgAuaXFjNLiyAC5pcWWMpZlte/ifJY9S5gJdT5kLLqfMgAAAAAAAAAAAAAAAAAAAAAAAAAAAAAAAAAAAAAALHqXMhY9S5gJdT5kLLqfMgAAAAAAAAAAAAAAAAAAAAAAAAAAAAAAAAAAAAAALHqXMhY9S5gJdT5kLLqfMgAAAAAAAAAAAAAAAAAAAAAAAAAAAAAAAAAAAAAALHqXMhY9S5gJdT5kDeLxAAAAAAAAAAAAAAAAAAAAAAAAAAAAAAAAAAAAAAALHqXMgAPY8AWXU+ZAAAAAAAAAAAAAAAAAAAAAAAAAAAAAAAAAAAAAAAAAK+p8yAAAAAAAAAAAAAAAAAAAAAAAAAAAAAAAAAPcwANgVdA0iPYyulbRVz9LG5+o/wATzWlJvNw9hr8kuQABQAAAAAAABknZvbdnrtS6leTnGlbKCUKbUXKVTNtcmnuwPWs/TeP1NaV9dSjZwm1RUMFUnTW1SnJ7I/A+vTLp1PnR/TPL751q8utWraapyhZWrUFSi8FOeClKU+O/BGd5wrI12H2vXi4UJ1HJfjU6ynJe1rBoxPuTtK70NK4hP6mxk8vnYYShJ7lUXt8GeHQrVberGtbzlRqweMZwbjJPmjaui3P8y9s4XiTqV4VLe42bHOOzOl8JDcGpm8FiZl3B2bY6VoEdQo1akrml5fm5msk/MaTwjh8uDZh1SLhmhLqi3F808DaXe3+kq3Kh96IvMRq07Gn2v1l/bWblkVxVhSc8McudpYnXO/oP8c07/M0vvIo9rvLtex0OjbV7KdRxqydKpCo1LalmUk0kYsk20ksW9iS3s2H6mf8AgWX7+X3Dw+wNNp3mtO4rJSp2MPNin+0k8sH7trJLod7RfTyrcU419Xqyt8yTVtTw8xJ/lyeKi/Zgeq+xO1quNGlWqKr+ZXjKaf8AVwZ5HfvcF1K9lo9tUdO3opfUuDwdSclmytr8WK8OJhkW4SUoPLKLxjJbGmuDQxarIO4+0LzRF9TTl9TYN4OqlhOm3uVSPt4r7DHz3bjvHWLnR5aVXcKkZrJO4km6sofkvw9+8+uydLp6lrtPzo5qFpF15xe6Ti0oJ/2niXcm0d/Qewbm+pQutSqStKM1jCjBJ1pRe5vNsh+E9z+Re1XLyFVqeduwVeOfH+rh/uOj393HdUa60ezqSpfIp3VSLwk83TTT8FhtZgaW3Fb9+PjiTFqsq7g7EutMpTu7Go7u1gs1SDWFanFfjbNkkvHD4GKmwewu4rm8c9JvZurUpQ8y2qz2ycF8soSfjhjsMX7t0unpeu16FFZaFTCvRivxY1N6XsUkxLvFRy9tdqXWvOVZz+nsqcssq2GaUpb3GEfwsyv+Ru1aGFKvXm6vj5leMJf8qSOXsevSue2Fa281TuKLq06jXVCc3KUJ4e8wjUu1u4LKrN3FpUrrHF3FJOtGX5zaxl8Sc3xWRat6dKNGVbR68qkksVb1sPnX5lSOH2/E8LtrtiWvV7mjUr/S/SpZ45c1Ryk2sMra2LDacWldz61osJ21tU/VfsK0XJQfGKeDiebK6uXXqXXmyjcVXKc6sW4ybm8ZdOG9l2NvT0dT0H/0nmtR+nVt52Xbgklmy4/ZiYP3D2OtF02WoQvfOVOUYypzgoNqTy/K1J4v2GUVqtVdhqqpy836CMvMxebHKtubeawqXNzWSVatUqpPFKc5SSfvYmRxgA0gAAAAAAADPPTLp1PnR/TMa7s/1JqP739GJknpi1hqUcfmxovDxw+cxvuxp9yai08f12HwjEz3VeQbP9O/9Pr/ADFX9E1gbO9O3H+X3g+m4qZvZsjvH0jWl3/f1/3k/vM2h3dB3PaFaVL5l5dGr/ZTg2/gawuGpXFZp4p1J4P2ZmbB7M7jtLzT4aLfyjG4pRdKmqmGWvSexR2+KWzDgL1Va6PQ7fjKevadGKxf1NJ4exSxZmN96a2tWs52N3K2pyePkzh5qj7IyzReHM7ul9vaH2tUp3N1cebe1pKjQqVMI/NP5cKVNY7/ABf4BkdT1M/h9l+/l9w8/wBNK0I3t/Qb+epShOK8cISaf3jv+pmCsLGL3utJpexQMJ0nU7jStQo39vtnSfzRe6cHslB80JwPR71tqlv3Jdua+Wu41qb4xlFL8KaPCNpVaOgd62EJxqYVqaxi4tKvQb3xlF719nA8iHpi/N+fUW6WO6NHCeHvngJfUYIZd6b1oR1e5oy2Sq2+Mfbkmm18Gc/dmldr6RpSs7dYaonF02pOVVrH55VvBRa/4GKabqFfTL+hf2/95QlmyvdKO6UH7JLYOYPZ79tqlHuKrWkn5dzCFSnLweWKpyXucTHDazWhd56ZFY4uO1JNK4t5vfs/2TPEXpj+u26i/J4Kj8+HDqwEvqvN9PLarV12VxFfqrejPPLwxqfLFe/affqR/HKHtto/fmZXpFTQdJu6fb2mtTuJRnUrSUlKWaC/xJeMn+StxifqQ09copNYq2jj7PnnvHYxyw1G9024VxY15UKy2NxeyS4Si9jXMyqy9SdQp5Ve2lKut0p05OlJrl8yPY0KPa2uaHR0yNKnGpCEVVoPCFeNVL5qkZb3i9uK9/A6Nf0xTqf9vqDjSe5VKWaS98ZJP4DM7Hr0J9vd6WNRyo/rYYRqZko16Mn0tTW9fYa01KyqaffXNjUeadvOVNyW6WG6XvRs3TdM0js7T61e4uG3UwdatUwUpuPTCnBczWmp30tQ1C5vprK7ipKajvyp9K9yHzyNjVtvp/s/+dH7iNXmx+yNas7/AEpaJduP1FGMqapT2KtRlj08Wk8Gjpax6fWVpY3V7a3VSHkQlVhTqqLhhFZsubY+QlxkYKADSAAAAAAAAOW3urm1m6lrWnQqNZXOnJweD8MYnG25Nyk223i29rbfiQADlo3d3QhUp0K9SlTqrCrCEnFTXCST2nEAAAA71LXdaow8ulqFxCG5RVWWC5bTqVq9e4qOrXqTq1XvnOTlL4s+AQcte6ublxlc1qldwWWDqSc3GPBZjiAKPqnUqUpqpSnKnUW6cG4yXvR3Za7rk4eXLUblw4ebL+k6AIK25ScpNuUni23i2/ayAFH3Sq1aM1Uo1JUqi3ThJxkvfE7VXW9ZrQ8urf3E6e5xdWWD+06QIPqnUqUakatGcqdSDxjODcZJ8U0WtWrV6sq1epKrVntlUm3KT5tnwCgm01JNqS3NbGved6nrut0o5KeoXMY+CVWX9J0QQcle5uLmfmXNadef5VSTm/8AqxOMAoJtNNPBramtjTOzW1HUa9Lya93Wq0f2c6kpR2btjZ1gAAAAAAHseALLqfMgAAAAAAAAAAAAAAAAAAAAAAAAAAAAAAAAAAAABhjs4/gAAACy6nzIWXU+ZAAAAAAAAAAAAAAAAAAAAAAAAAAAAAAAAAAAABePwAAAACy6nzIWXU+ZAAAAAAAAAAAAAAAAAAAAAAAAAAAAAAAAAAAAAAAWPUuZCx6lzAS6nzIWXU+ZAAAAAAAAAAAAAAAAAAAAAAAAAAAAAAAAAAAAAAAWPUuZCx6lzAS6nzIWXU+ZAAAAAAAAAAAAAAAAAAAAAAAAAAAAAAAAAAAAAAAWPUuZCx6lzAS6nzIfUoyzPY9/AmWXBgQFyy4MZZcGBAXLLgxllwYEBcsuDGWXBgQFyy4MgAAAAAAAAAAAAAAALg3uQEBcsuDGWXBgQFyy4MZZcGBAXLLgxllwYEBcsuDGWXBgQsepcxllwZYxlmWx7+AH/9k="
}
